id,fullname,address,phone_number,email,workplace,birthdate,registration_date,gender,income,expenses,credit,deposit
527,Pancrate Denisovich Korolev,"Art. Moscow ALL. Parkhomenko, d. 3/9, 213 733",8 (380) 926-7353,vadimkazakov@yahoo.com,"from. Ust-Dzheguta, etc. Vladimir, d. 8/8, 825 265",30861,41011,M,,96088,,
528,Konovalov Rodion Germanovich,"Art. Usman, trans. Chaikinoi, d. 41 to. 6, 808,608",82520530745,nesterovamargarita@gmail.com,"COFO Kargasok, pr. Nekrasov, d. 132 pp. 55, 053 552",34390,43277,M,,80004,,
529,Ninel Zhdanovna Suvorov,"COFO Mozhga, nab. Tereshkovoy d. 306, 990 884",+7 546 976 1362,belousovarkadi@hotmail.com,"Art. Shenkursk, trans. Kurskiy, d. 513, 952 129",26487,42157,F,,83218,,
530,Fedosov Vsevolodovich Sox,"from. Maikop, ALL. Large, d. To 6/4. 8, 831 829",83669110097,sergeevamarina@rambler.ru,"COFO Dixon, nab. Stakhanovskaya, d. 88 p. 92, 277810",24413,42437,M,,107743,,
531,Seleznev Maya Albertovna,"a. Essentuki, st. Pugachev, d. 125 to. 25, 863 196",88702447638,aevseeva@hotmail.com,"n. Upper Ufalej, nab. Labor, d. To 26. 9, 711 784",34027,41018,F,213855,88766,1,1
532,Mironov Varlaam Gavrilovic,"d. Birobidzhan, bul. Novoselov, d. 9/7, 074 902",+75552835845,cmuravev@gmail.com,"d. Olenegorsk (Yaqut.) ALL. Ivanova, d. 7, 513,128",29133,43453,M,,84843,,1
533,Ian Matveevich Kononov,"n. Maikop, nab. Papanin, d. 6/7 p. 7/6, 292335",8 861 125 78 63,kiselevvissarion@yandex.ru,"a. Kizilyurt, w. Enthusiasts, d. 55, 783 326",35582,41844,M,288878,103803,1,
534,Galkin Vadim V.,"Art. Ternay, w. Tsiolkovsky, d. 872 p. 8/1, 326 303",8 302 680 4511,sevastjan_1970@rambler.ru,"COFO Elnya blvd. Novosel'skii, d. 94 p. 6/2 304667",34683,43334,M,,82761,,
535,Titova Margarita Alexandrovna,"Art. Aniva lane. Brigadier, d. 7 in. 978 763 132",8 (016) 432-5998,paramonlarionov@yandex.ru,"d. Pechora Lenin ave., d. 8/5, pp. 3, 905,386",30335,43422,F,192506,78265,1,
536,Sofron Izotovich Galkin,"n. Viborg, pr. Mound, d. 536, 797 215",+7 541 468 4453,poljakovladislav@yahoo.com,"COFO Novorossiyka, ALL. Iaroslavskaia, d. 9, 325 139",30586,42422,M,,84029,,
537,Markov Milovan Avdeevich,"n. Gorodovikovsk, w. Privolnoe, d. 5 pp. 6/6 783432",+7 (593) 735-1159,seliverstovazhanna@mail.ru,"d. Lazarevskoye, trans. Border, d. 3/8 p. 4, 453,305",26693,42253,M,,100213,,
538,Cyrus Tarasovna Khokhlova,"d. Novorossiysk, w. Red partisans, d. 2/6 in. 3/6, 121416",8 (032) 398-02-43,vseslav49@gmail.com,"from. Tula, w. Schmidt, d. 468, 730 406",24156,41322,F,,85748,,1
539,Evgeny Novikov Vladlenovich,"Mr. Kyren, ALL. Working, d. 6 in. 6/8 132711",8 924 544 4650,efimkovalev@yahoo.com,"from. Ust-Kool, w. Troitskoe, d. To 2/6. 1 011 749",30752,42058,M,,88909,,
540,Anna Haritonovna Moses,"from. Kizilyurt Str. Freedom, d. 1/5, 590,358",8 (997) 331-0578,zikovborislav@gmail.com,"a. Pinega, nab. Marketplace, d. 8/5 in. 185 862 608",37152,42555,F,,83963,,1
541,Akulina Veniaminovna Loginova,"a. Nevinnomyssk, bul. Station, e. To 4. 432, 395856",8 784 168 8319,dkarpov@rambler.ru,"Art. Taishet, pr. Krasnogvardejskiy, d. 861, 184 859",22292,41673,F,,69587,,1
542,Glafira Nathanovna Krylov,"Ruza, etc. Papanina, d. 5/7 in. 66 725 385",+7 (140) 946-4092,radovangolubev@mail.ru,"from. Cheremkhovo, w. Steppe, d. 73 p. 5, 367,584",27993,42616,F,272128,73759,1,
543,Konovalov Spartak Glebovich,"n. Bologoe, w. Power Engineers, d. 9/4, 128715",+7 344 502 87 64,radim1983@yahoo.com,"COFO Tchebarkul, pr. Zarechnyi, d. 84, 785 049",27358,42448,M,,77550,,
544,Popov Samson Davidovich,"n. Khabarovsk, pr. Matrosov, d. 66, 381202",+7 005 899 2582,petuhovatamara@yahoo.com,"COFO lips lane. Airfield, d. 130, 982 473",25844,42043,M,,74349,,
545,Anastasia Robertovna Agafonov,"a. Zaraysk Str. Tomsk, d. 838 p. 8/8, 397590",+7 (606) 533-93-54,sigizmund82@yandex.ru,"from. Revda (Sverd.), Acad. Trinity, d. 96 to. 15, 754 957",36291,41549,F,,77028,,
546,Lebedev Auxentios Cheslavovich,"Ust-Orda, st. Schmidt, d. 5, 322646",+7 634 378 0568,vinogradovvatslav@hotmail.com,"d. Nefteyugansk, nab. 1 Maya, d. To 149. 9 644 552",36227,41011,M,,85540,,
547,Ustin Germanovich Bespalov,"Art. Moscow, MSU, ALL. Cheerful, d. 535, 401 740",88309227362,averjantrofimov@gmail.com,"Kirovsk (Lenin.), Str. Coniferous, d. 71 to. 54, 784 122",29947,42400,M,,55366,,
548,Pancakes Sofron Ilyasovich,"Monchegorsk Street. Road, d. 13, 119 919",+7 (383) 197-6860,ilitkin@hotmail.com,"n. Moscow, pr. Azov, d. 9 in. 376 405 285",33185,41814,M,,76906,,1
549,Auxentios Dem'yanovich Drozdov,"COFO Tsimlyansk, nab. Repin, d. 30, k. 441 733 424",8 (055) 800-80-18,bikovaeleonora@gmail.com,"from. Egorievsk Str. October, d. 4/9, pp. 936, 516 857",24172,43564,M,249780,69466,1,
550,Novikov Elizabeth Maksimovna,"d. Krasnoural'sk, nab. Paris Commune, d. 3/2 in. 2/9, 141 862",89273401299,svetozargromov@rambler.ru,"COFO Rylsk, trans. 60 years of the USSR, d. 585, 863 219",31193,41210,F,,84757,,1
551,Love Yulianovich Baranov,"d. Severobaikalsk, nab. Circumferential, d. 2/2 p. 8, 703 760",+7 (213) 191-14-80,kononovnikandr@mail.ru,"Art. Snezhnogorsk (Moorman.) Emb. Student, d. 97 p. 2 914 177",24566,42468,M,,65280,,
552,Merkushev Afinogen Iosipovich,"from. Kirovo-Chepetsk, pr. Sakhalinsky, d. To 944. 3 635 853",+70021871691,mstislav_1981@gmail.com,"Sibai, bul. The traveler, d. 80, 384 843",35626,40910,M,,95926,,
553,Athanasius Aaranovitch Belyakov,"a. Stavropol, trans. Small, d. 6 pp. 8/5, 970,936",8 (379) 387-85-95,ribakovspartak@yandex.ru,"g. Cheboksary, bul. Krasnoarmeysky, d. 5 k. 5/9 826043",36769,42517,M,156150,92390,1,
554,Nikonov Leo Zhanovich,"Art. Artem, nab. Border, d. 9, 930 539",87855576705,kfedoseev@hotmail.com,"d. Ust-Kut, nab. Zaprudnaya, d. 870 pp. 525, 072 144",31878,42548,M,116304,95784,1,
555,Maria Osipova Efimovna,"k. Vitim pr. Rural, d. 4 to. 270, 368 507",81144999549,nonna2006@yahoo.com,"Art. Mtsensk, w. Walnut, d. 9 k. 220, 496 564",34433,43609,F,230356,96339,1,
556,Svetozar Vladilenovich Isakov,"n. Sibai, ALL. University, d. 77 to. 70, 310 261",8 923 744 01 59,gerasimovavde@mail.ru,"d. Abakan, ul. Naval, d. 22 to. 3 752 401",36152,41047,M,125672,82708,1,1
557,Eustace Gordeevich Ustinov,"a. The hype, bul. Stepan Razin, d. 62 pp. 359, 504 813",8 (916) 872-80-76,askold_1986@hotmail.com,"d. Tulun, ul. Uritskogo d. 536 pp. 10, 904 371",26725,41917,M,,67957,,1
558,Sofia Yakovlevna Merkusheva,"COFO Korolev, nab. Smolenskaya d. 4.6 pp. 92, 901 255",8 (504) 956-24-77,lavrentevradislav@yahoo.com,"n. Severobaykalsk Str. Kama, d. 4, 534,791",36330,41239,F,,84703,,
559,Vseslav Teimurazovich Fists,"d. Bijsk, pr. Meadow, d. to 7/9. 4, 691,077",+7 668 990 6983,german47@rambler.ru,"Solikamsk, ALL. Haharina, d. 1 k. 5, 394,696",31174,41618,M,,81162,,
560,Oksana Kalashnikova Valentinovna,"from. Taldom, w. Track, d. 1 k. 28, 629 285",+7 (123) 152-8587,ttimofeev@mail.ru,"Art. Kostomuksha, w. Goncharova, d. 3/7, 581 705",28698,41541,F,217562,90445,1,1
561,Sazonov Roman Danilovich,"n. Palana, nab. Peace, d. 815, 051 564",+79496069195,petuhovaljubov@hotmail.com,"d. Kizilyurt, w. Chekhov, d. 175, 675 709",36238,43752,M,184049,68375,1,1
562,Ksenia Sokolova Timofeevna,"Art. Makushino, pr. Short, d. 4/9 824135",86915145215,irakli_55@yahoo.com,"Art. Petushki, w. Cooperative, d. 129 p. 4, 730,466",23221,41091,F,,66905,,
563,Fock Edgarovich Shcherbakov,"Art. Noyabrsk, bul. Peasant, d. 1/9 p. 1/9, 366 649",8 (841) 124-5731,litkinamaja@yandex.ru,"a. Abinsk, nab. Marx, d. 166, 515 496",26013,43377,M,,82046,,
564,Pelagia Timurovna Kudryashov,"n. Yaksha Str. Labor, d. 8/3 p. 5/2, 781 610",+78610648679,bikovaklavdija@gmail.com,"a. Krasnoturinsk, ALL. Chkalov, d. 739 to. 4/3, 337 990",24967,41948,F,,85635,,
565,Nina Baranova Askoldovna,"d. Rossosh, bul. Average, d. 6/6 pp. 965, 760 867",8 (571) 261-72-86,isidor1994@yahoo.com,"d. Lysva Str. Gornyatsky, d. 25, p. 7, 080,731",23980,41421,F,117429,76868,1,1
566,Pakhomov Bojan Antipovich,"d. Terrible, w. Aircraft, d. 7 pp. 3, 137,964",+7 578 345 46 98,dorofe1990@gmail.com,"from. Lodeynoye Pole, w. Popov, d. 9, 273 280",37367,41086,M,285911,101303,1,
567,Oktiabrina K. Rogov,"from. Bilibino, nab. Ul'yanova, d. 16 p. 9/1 624055",8 328 612 03 93,bobilevmefodi@hotmail.com,"a. Suzdal, w. City, d. 219, 966 033",32829,41919,F,121028,57680,1,1
568,Sergey Fedorovich Desk,"a. Balashikha, sh. Krasnoflotskoye, d. 8 to. 605, 122 284",8 246 800 1498,kira78@yahoo.com,"Kamyshin, bul. Ivanovskii, d. To 5/2. 2/3, 195,290",24314,43609,M,,98497,,1
569,Victoria Isakova Oskarovna,"COFO Essentuki, st. Motorists, d. 41 to. 244, 381 248",8 (481) 934-8825,burovsolomon@hotmail.com,"a. New Urengoy, ul. Mechanical Engineers, d. 2 to. 95, 673 566",28788,40985,F,,92610,,
570,Krasil'nikova Marina S.,"Schelkovo, st. Taezhnaya, d. 220, 212 882",+71625340799,tsvetkovbronislav@gmail.com,"n. Elbrus, bul. Teachers, d. 288 p. 9/2, 269 897",24108,41340,F,291128,74150,1,1
571,Vincent Yevstigneyevich Ovchinnikov,"a. Great Ustyug, trans. Musa Jalil, d. 7/9, pp. 291, 828 246",+7 (733) 303-12-36,demjan_42@gmail.com,"Art. Masty, w. Sovkhoznaya, d. 3 k. 3/2 436808",26210,43821,M,170262,93349,1,
572,Regina Gavrilova Bogdanovna,"g. Arzamas, ALL. Quiet, d. 21, p. 5, 898,094",8 (115) 919-0868,kudrjavtsevaangelina@mail.ru,"from. Uchaly, nab. Highway, d. 5, 725,058",23569,41081,F,,97508,,1
573,Polina Naumova Arkhipovna,"Art. Domodedovo, trans. Basil, d. 932 to. 567, 571 189",8 (312) 249-36-63,frol_95@rambler.ru,"a. Snezhinsk, ALL. Kiev, d. 3/7 pp. 991, 021 662",27962,41377,F,109699,87496,1,
574,Faith Robertovna Aksenov,"a. Volkhov, bul. Surikov, d. 39, 533 430",+7 (702) 301-6362,belozerovprokl@yahoo.com,"a. Novorossiysk, nab. Kama, d. 46 918 843",33302,41072,F,246564,80024,1,1
575,Ludmila Drozdov,"from. Krasnogorsk (Mosk.), Acad. 40 October, d. 3, p. 3, 631,571",8 (594) 313-76-35,zhanna_91@mail.ru,"d. Vytegra, pr. Yaroslavskyy, d. 1 k. 51, 554 428",22695,42450,F,145840,78780,1,
576,Philemon Alexandrovich Arkhipov,"from. Pushkin Mountains, w. Kazan, d. 7 pp. 2 570 497",84690142511,avdekrjukov@mail.ru,"d. Uglegorsk, ul. Peace, d. 71 to. 206, 641 700",32879,43007,M,,66044,,1
577,Sofia Petrovna Solovyov,"n. Cherusti, trans. Lazo, d. 96 to. 1 944 483",+75892883488,kira1994@yandex.ru,"n. Suzdal, ALL. Amur, d. 7, 517,189",28643,43248,F,297761,91597,1,
578,Selivan Feodosevich Martynov,"n. Shelehov blvd. Pushkin, d. 933, 488 893",+78086813609,suvorovstepan@gmail.com,"n. Essentuki, ALL. Guerrilla, d. 5/3, 692 972",25023,43780,M,,95265,,
579,Sidor G. Galkin,"Art. Nefteyugansk, ul. Large, d. 40, 236 559",+78867600969,prohorovipat@mail.ru,"COFO tulpan river, trans. Maxim Gorky, d. 88 in. 9/5, 207 130",23559,42006,M,,76787,,1
580,Sukhanov Mitofan Fokich,"Kovrov, ave. Short, d. 2/3 599819",+7 (514) 658-7030,ckostin@hotmail.com,"Arkhangelsk, Embankment. Tips d. To 5/9. 365, 880 771",36017,42397,M,,66671,,
581,Kopylov Trifon Zhanovich,"Mr. Cherskii, nab. Lunacharskii, d. 284, 411 426",8 (832) 017-8632,ignati2007@yandex.ru,"Mr. Psebay, etc. Baikal, d. 51, 140514",31901,43068,M,,92714,,
582,Seliverstov Haggai Aaranovitch,"Art. Muravlenko Str. Karl Marx, d. 69, 293297",8 895 231 1693,solomon1978@rambler.ru,"from. Lyubertsy, nab. Tambov, d. 244, 315282",34350,43148,M,,73174,,
583,Grishin Fedot Timurovich,"k. Nazran, pr. School, d. 2 pp. 28, 760 047",+75611902769,anike75@rambler.ru,"Art. Noyabrsk, nab. Ivanovo, d. 996, 202936",28790,43647,M,217482,74614,1,
584,Regina Stanislavovna Shiryaev,"Art. Derbent, ul. Spataka, d. 2 k. 1/9, 629,520",86675431221,mstislav35@yandex.ru,"n. Tutonchana Str. Krasnogvardejskaya, d. 572 pp. 397, 710 225",36337,43477,F,,69544,,1
585,Anisimova Thekla Valentinovna,"COFO Severodvinsk, bul. Friendship, d. 4, p. 6, 846,904",+7 075 664 6203,minaosipov@rambler.ru,"from. Urai, trans. Kiev, d. 943, 642 507",22366,41038,F,,95590,,
586,Artemyev K. Love,"n. Staraya Russa, nab. Zhukovskogo d. 128, 860 483",8 (626) 351-7030,alekseevpolikarp@hotmail.com,d. Sladkova Str. Komsomolskaya. 3 847 545,30272,42540,F,,95399,,1
587,Davydov Selivan Harlamovich,"COFO Yar-Sale, trans. Sedova, d. 82 k. 7/5, 024,050",+73634204450,simon_65@hotmail.com,"Bratsk, trans. Meliorativny, d. 3, 931,210",31475,43431,M,194348,87421,1,
588,Sorokin Agatha Nathanovna,"n. Tobolsk, w. Schmidt, d. 9/2 pp. 610, 790 286",8 (800) 791-10-42,rodionovamvrosi@rambler.ru,"COFO Buynaksk, nab. Postal, d. 44, 749 650",31280,42119,F,,70166,,
589,Marina Bobrova Egorovna,"k. Tobolsk, pr. The high voltage, d. 840 p. 9/2 020613",85437563125,evdokija68@rambler.ru,"from. Upper Tagil, st. Chkalov, d. 48 in. 803 148 703",30983,41492,F,259949,58427,1,
590,Rozhkov Prov Fokich,"n. Arkhangelsk, bul. Children, d. 2/6 p. 65, 209573",+7 833 207 77 26,mir2019@yahoo.com,"Zavodoukovsk blvd. Pond, d. 94 to. 92, 434 113",28978,42121,M,201028,79793,1,
591,Hope Kirillovna Nazarov,"d. Vendinga w. Kutuzova, d. 29 to. 93, 650 153",8 (068) 336-4442,tsvetkovalarisa@hotmail.com,"Art. Dixon, ALL. Shevchenko, d. 140 to. 2/9, 658,419",28908,42798,F,103517,76184,1,
592,Davydova Veronica Filip,"Torzhok, ul. Chervonoarmijska, d. 15, 112640",+70709891062,lukjan_62@rambler.ru,"Art. Suzdal, ALL. Karl Marx, d. 83 in. 984 400 780",32129,41235,F,,71828,,
593,Lytkina Xenia Alexandrovna,"n. Achkhoy-Martan, trans. Vavilov-, d. To 8/9. 57 498 804",+7 437 038 2904,olimpiada_01@rambler.ru,"from. Michurinsk, ALL. International, d. 677, 047 870",33593,42138,F,190212,91041,1,
594,Galina Stepanova Vladislavovna,"n. Volokolamsk, bul. Dobrolyubova. 659 to. 24, 359013",+75851460232,egorovaglafira@gmail.com,"a. Kamyshin, bul. Kama, d. 44, 414 935",26546,43657,F,,86924,,1
595,Nadezhda Popova Arkhipovna,"d. Aginskoe (Zabayk.) Emb. Repin, d. 2 pp. 2/2 412981",+77721319190,hafanasev@yahoo.com,"a. Solikamsk, st. Kommunarov d. 8, 784 312",29465,42138,F,118288,79380,1,
596,Kulagin Trifon Valerianovich,"Chegem Str. Altitude, d. To 4/4. 57, 227471",8 (366) 617-55-62,shashkovaveronika@hotmail.com,"from. Gorno-Altaisk, trans. Puteyskaya, d. 7/2 p. 93, 238158",28620,42405,M,,96468,,1
597,Fock Arsenovich Rozhkov,"Art. Nevyansk, ul. Minsk, d. 219, 710 023",8 571 286 79 54,danilovkliment@hotmail.com,"from. Khimki, bul. Friendship, d. 6 pp. 5/6 984260",22454,41574,M,,75134,,1
598,Akulina Ilinichna Gulyaev,"COFO Katav-Ivanovsk, bul. Ushakov, d. 28, pp. 159, 800 155",8 835 907 0261,makarovkazimir@yahoo.com,"d. Siktivkar, ave. Grandma, d. 3, p. 81, 314693",36663,42188,F,,113231,,
599,Bogdanov Carl Ignatievich,"d. Gudermes lane. February, d. 2/9 in. 9/4, 704 535",+7 683 076 57 91,uljan1979@rambler.ru,"COFO Chikola, w. Miner, d. To 46. 6, 562,385",32642,41763,M,138726,75525,1,
600,Euphrosinia Tarasovna Denisov,"d. Kargasok, trans. Stepan Razin, d. 3/4 pp. 463, 985 036",+7 (308) 887-9563,eliseevandre@mail.ru,"COFO Urjupinsk Str. Pavlova, d. 3/5, 705 400",34194,43480,F,181300,81443,1,
601,Olympia Arturovich Kirillov,"from. Mezhdurechensk, ALL. Zaovrazhnaya, d. To 5/3. 4, 268,430",+7 (931) 521-40-18,cdementev@yahoo.com,"COFO Zavodoukovsk, nab. Moss, d. 659, 822 504",26484,41035,M,104389,82124,1,
602,Olympics Maksimovna Gerasimova,"d. Chulym, ALL. Kalinin, d. 1 743 089",+7 (988) 995-73-68,eremegorshkov@hotmail.com,"n. Ustyuzhna, trans. The water, d. 2 pp. 26, 875 601",26918,41303,F,,82424,,
603,Theophane Gavrilovic Mamontov,"Uvarovo, w. Surikov, d. 2/9 in. 490, 391489",+7 743 077 31 04,vinogradovljubosmisl@hotmail.com,"COFO Angarsk, nab. Apricot, d. 679 to. 5/4, 050 316",29476,42372,M,,86628,,
604,Kirillova Natalia,"Art. Ardon, w. Parkhomenko, d. 6, 667,320",+73165064892,apollinarinikiforov@gmail.com,"from. Vorkuta, bul. Sunny, d. 528, 694 678",35719,42515,F,,72637,,
605,Kuznetsov Benedict Avdeevich,"Art. Terskol Street. Prudnaya, d. 61, 189043",+74628694901,zinovevevse@yandex.ru,"n. Kogalym, nab. Comintern d. 3.1 pp. 41, 861 818",31212,41723,M,,91765,,
606,Dorofeev Micah Valer'yanovich,"Ufa, pr. Commune, d. 82 pp. 15, 343 199",+73551200007,arhipovalidija@yandex.ru,"COFO Dombay Street. Maxim Gorky, d. 1/4, 730 283",37430,43351,M,,69284,,
607,Ekaterina Danilova Haritonovna,"COFO Millerovo ALL. M.Gorky d. 5 to. 89, 365912",+7 946 940 9461,gnesterov@gmail.com,"Severo-Kurilsk, etc. Tchaikovsky, d. 63, 276 361",23448,40967,F,237199,78587,1,
608,Angelica Mironovna Tikhonov,"n. Hassan, ALL. Baikalskaya d. 724 p. 5, 955,494",+7 (120) 122-7583,melnikovzahar@rambler.ru,"d. Izhevsk, ul. Radishcheva d. 2 to. 142, 882 773",35858,41985,F,,83896,,
609,Yakovleva Elena G.,"Art. Kaluga, trans. Vidradny, d. 286, 974 091",82949305699,kira_1992@mail.ru,"from. Inta, ALL. Tulenin, d. 4/4 in. 984 403 689",27868,41396,F,,93240,,1
610,Medvedev Taisiya V.,"Tikhoretsk, w. Tolbukhina, d. 2 to. 85, 014 340",+76823188261,rkuznetsov@gmail.com,"n. Nizhneudinsk, trans. Labor, d. 1/4, 272 259",36253,42134,F,267122,74615,1,
611,Petukhova Sofia Timurovna,"Art. Krasnoselkup Str. TBN, d. 92 p. 5, 479,264",8 832 810 8533,kuznetsovparfen@hotmail.com,"COFO Uchalu, pr. Ogorodny, d. 212 p. 5, 311198",31802,41054,F,223057,99142,1,1
612,Simon Akulina Filip,"a. Bologoe blvd. Spring-water, d. 1/9, 141 671",83283208266,evdokija_21@mail.ru,"from. Fatezh, ALL. Linear, d. 9 pp. 2/4, 767,838",25725,41328,F,,67690,,1
613,Lazarev Zoya,"from. Vilyuisk, pr. Ulyanovsky, d. 9, 094 801",+71971756084,bogdanovsavvati@rambler.ru,"d. Wasp, w. Gogol, d. 147 to. 4/4 129499",30238,41099,F,251310,78083,1,
614,Kira A. Popov,"COFO Onega, bul. Ryazan, d. 582, 370036",8 951 782 9973,kim_2001@yahoo.com,"d. Sorochinsk, pr. Schorsa, d. 9, 458 760",22833,42547,F,107109,76091,1,
615,Raisa Panova L.,"d. Anadyr Street. Suburban, d. 34, 183330",8 118 000 00 81,komarovlukjan@hotmail.com,"g. Taganrog, ALL. Hothouse, d. 350 to. 119, 655 586",27180,42160,F,296916,98766,1,
616,Bogdanov Zinaida,"Mr. Psebay, nab. Pozharsky, d. 2/2, 574 892",+7 975 360 6593,okalinina@mail.ru,"from. Kargopol, w. Civil, d. 172 p. 3, 809,127",25232,42827,F,,77206,,1
617,Evgeniya Uvarova Naumovna,"n. Oktyabrskoe (Hunt.), br. Ivanova, d. 18 to. 57, 635 182",8 (415) 495-26-55,frolovaverki@mail.ru,"d. Kalachinsk Str. Lilac, d. 79, 032 567",30583,42924,F,,93095,,1
618,Julius Gurevich Lavrentiev,"d. Bavly ul. Koshevogo, d. 36 k. 2/4, 944,451",+7 (704) 731-2271,melnikovnikifor@gmail.com,"COFO Ishim lane. Port, d. 8/6 p. 27, 749 629",28852,43179,M,,82395,,1
619,Kupriyan Ignatovich Ustinov,"Karachaevsk blvd. Sports, d. 4, pp. 765, 620 957",+7 161 654 79 98,fdementev@mail.ru,"COFO Lipetsk, nab. Vatutin, d. 3/4 pp. 270, 741 275",29913,43639,M,121510,108730,1,
620,Matveev Eduard Yulevich,"Art. Ivdel, bul. Krasnoyarsk, d. 2/1 p. 4/2, 705 143",8 634 937 5722,karldenisov@hotmail.com,"n. Sochi, w. Post, d. 39, 835 455",32194,41909,M,,99916,,
621,Maya Naumova Zhdanovna,"Snezhinsk, ul. Roadside, d. 20, pp. 21, 542 855",8 363 258 53 34,kovalevgorde@hotmail.com,"d. Zavyalikha Str. Port, d. 61 pp. 9, 321 178",22502,43006,F,,77396,,
622,Veronica Efimova Eduardovna,"n. Taldom, trans. Port, d. 2/3 p. 635, 183330",8 (581) 477-3961,bogdan_1978@hotmail.com,"Art. Barnaul, w. Minsk, d. 8 to. 129, 742 215",23048,42127,F,280031,74017,1,1
623,Miron Gertrudovich Sobolev,"Mytischi, ALL. Adolescence, e. 6/4 p. 9, 077 963",8 980 432 7079,lshestakova@yandex.ru,"a. Mine Street. Dzerzhinsky, d. 27, k. 859, 879 030",35181,42141,M,269413,100803,1,1
624,Samsonov Philemon A.,"from. Yuzhnouralsk, bul. Lyavonau, d. 98 to. 13, 425 869",+7 (239) 035-5166,raisa_31@yandex.ru,"Magadan, ul. Tukaya, d. 4, 687,418",34827,41208,M,209136,87691,1,1
625,Marina Egorova G.,"from. Yelnya, trans. Energy, d. 4, p. 366, 116552",8 914 412 75 88,btihonova@hotmail.com,"a. Smolensk lane. Tchkalov, d. 8, 620 251",34475,42404,F,154035,74373,1,1
626,Vladislav Lobanov Ermilovich,"k. Severobaykalsk pr. Theatrical, d. 481, 179690",89925571504,zhanna54@mail.ru,"COFO Sorochinsk, w. Don, d. 825 to. 4/9 227754",23441,42548,M,,89802,,1
627,Yemelyanov Evdokia Valerievna,"a. Ust-Ishim, bul. Azine, d. 3/5, 159 593",+7 966 238 3435,ksergeeva@rambler.ru,"a. Solnechnogorsk, ALL. Substations, d. 2 759 091",37299,41968,F,,61834,,
628,Fevronija Rubenovna Bobyleva,"COFO Khuzhir, bul. Union, d. 4/4 in. 7/6, 257711",+7 (041) 953-54-18,xnosov@yahoo.com,"d. Kartaly lane. Geologists, d. 5/2, pp. 913, 416 930",36645,41548,F,284327,80486,1,
629,Baranova Ulyana Semenovna,"d. Tchebarkul, pr. West, d. 37 p. 7, 326,289",+7 243 880 04 71,imjasnikov@hotmail.com,"of Plesetsk, trans. Marx, d. 84 p. 509, 001002",27581,41035,F,219996,89335,1,1
630,Milica Antonovna Kalinin,"Art. Ketchenery, w. Minsk, d. 5 pp. 3/5, 813,916",+7 (010) 025-46-45,fkonovalov@yahoo.com,"a. Naberezhnye Chelny, w. Land reclamation, d. 3/7 p. 90, 219861",24130,41708,F,,92021,,
631,Kharitonov Adam Feoktistovich,"Nogliki, ALL. People, d. 224, 031 641",81768583438,svjatopolk_71@hotmail.com,"n. Suntar Str. Construction, d. 2 064 461",31765,42428,M,235948,72430,1,
632,Lyudmila G. Pavlov,"d. kirovsk (Lenin.), Acad. Rowan, d. 6 k. 853, 577 570",+7 (850) 559-81-61,zshcherbakov@mail.ru,"Art. Ramenskoye, w. Kosmodemyanskoy, d. 7, 474,628",34026,42965,F,,75941,,1
633,Noskov Olympics Romanova,"from. Holmogory, pr. Nikitin, d. 97 p. 835, 481060",8 (006) 504-43-94,feoktistjudin@mail.ru,"Art. Rostov-on-Don, Embankment. Vladimir, d. 468 to. 5/2, 313 712",33212,42623,F,139287,85259,1,
634,Isot Feofanovich Kulagin,"n. Turuhansk Str. Azovskaya, d. 8, 637 676",+7 (263) 458-4981,komarovasinklitikija@mail.ru,"from. Smolensk, ALL. Krylov, d. 80 to. 31, 580 082",35350,43793,M,196554,85230,1,
635,Gerasim V. Ponomarev,"n. Ozery ALL. East, d. 6, 954,575",+7 685 886 8959,osip_73@yahoo.com,"COFO Kataysk blvd. Poplar, d. 610, 602805",24061,43722,M,,102616,,
636,Krylov Moses Efremovich,"d. Nevelsk, w. Chapayeva, d. 4 k. 4/1 657565",+7 (772) 833-67-75,molchanovprokl@gmail.com,"from. Ulyanovsk, ALL. Flower, d. 68 495 881",25607,41070,M,,74547,,1
637,Denisov Zinaida Vladislavovna,"a. Olenek, ALL. Cossack, d. 5 to. 68, 887 479",+7 709 230 65 18,radislav_1990@yandex.ru,"Art. Kimry, w. Sennoe, d. 2/8 in. 1/4, 733 292",23541,42624,F,,73075,,
638,Evdokia Oskarovna Vasilyeva,"a. Vyborg, ALL. Shock, d. 7 to. 272, 175 352",8 (589) 002-49-02,mamontovalukija@hotmail.com,"from. Usinsk, trans. Nagorny, d. 4/2 in. 90 268 019",25552,42666,F,273733,92724,1,
639,V. Yakovlev Lukiya,"Art. Solikamsk, nab. Edible, d. 56 to. 65, 083 722",8 253 024 5547,erofe_1982@mail.ru,"d. Tymovskoye, pr. cedar, d. 3/5, 885,183",37007,40998,F,136121,87776,1,
640,Irina Sidorova Timurovna,"COFO Tynda, bul. Floatable, d. 1 k. 27, 551 031",8 561 602 03 81,njudina@mail.ru,"COFO Jurowski, w. Kirova. 314 to. 4, 540,986",26516,42615,F,,81639,,1
641,Alexandrov Agatha Igorevna,"COFO Birobidzhan, trans. Tolstoy, d. 78 in. 2/1 185136",8 (777) 914-7473,titsuhanov@rambler.ru,"from. Krasnoyarsk, trans. Field, d. 2/5 p. 13, 338060",23523,42464,F,,71434,,1
642,Yakov Ryabov Ignatovich,"d. Chatou, nab. Sholokhov, d. 7/2 in. 381 773 906",+7 005 848 3926,viktorefimov@rambler.ru,"from. Pavlovsky Posad, trans. Krasnodar, d. 252 to. 8/4, 653 210",36125,43231,M,166691,96079,1,
643,Dementiy Chernov Bronislavovich,"n. Uraj, pr. Thalmann, d. 6 pp. 6/2 874852",+7 (737) 388-63-42,sofron44@yahoo.com,"n. Arsenyev, w. DEN, e. 1/1 360230",23478,41146,M,,64414,,
644,Casimir Bogdanovich Nosov,"COFO Nefedova Str. Aviation, d. 34 k. 8/2 218036",85791697218,zahar_2013@yahoo.com,"d. Kamensk-Uralsky, nab. Mechanical, d. 48 p. 8/4, 973 679",27541,41888,M,119634,95911,1,
645,Martha Kuzminichna Krasil'nikova,"Vladikavkaz, ul. Tomsk, d. 94 p. 88, 307563",8 282 911 87 78,ipati19@yandex.ru,"Art. Berezniki, nab. Gully, d. 59, 793 769",31484,42310,F,,69809,,1
646,Matveev Frol Dem'yanovich,"d. Toksovo Str. Griboedova. 87, 850 173",8 (675) 358-9845,milovan_1979@hotmail.com,"d. Noginsk (Mosk.) ALL. 60 years of the USSR, d. 8, pp. 13, 962 028",32719,41680,M,225492,71618,1,
647,Ekaterina Ignatieff Oskarovna,"from. Kanev, trans. Nakhimova d. 1/4 p. 8, 047 417",+76104344274,ermakovaglafira@mail.ru,"Lesnoy (Sverd.), trans. Bird cherry, d. 8/4, 450 190",36169,41669,F,,74801,,1
648,G. Mukhin Ladimir,"Yuzhno-Kurilsk, trans. West, d. 6/6 p. 5/8, 789 250",+7 331 810 9586,seliverst27@yahoo.com,"from. Zavyalikha, ALL. October, d. 8/5, 835 098",33427,42275,M,,73529,,
649,Konstantin Stepanov Dem'yanovich,"n. Belomorsk, ALL. Proletarshaya, d. 8, 503 119",8 (332) 732-5670,ribakovmakar@yandex.ru,"COFO Olenek Str. Odessa, d. 309 p. 2/6, 215 337",23237,41163,M,271462,58718,1,1
650,Shestakova Lyudmila Afanasyevna,"d. Shatura, ALL. Griboedova. 87 pp. 9, 860 649",+76888765643,varlaam_28@yandex.ru,"d. Vsevolozhsk, trans. Average, d. 44 in. 2/2 443027",24713,43147,F,,92639,,
651,Seliverstov Ambrose Davidovich,"from. Kyshtym, ALL. Chapayeva, d. 1 k. 58, 225386",+7 413 344 34 66,parfen2008@yahoo.com,"d. Samara, ul. Martha 8, d. To 6. 7, 089,861",30159,42456,M,,103310,,
652,Kovalev Philemon Aksonovich,"a. Kataysk, w. Superior, d. 301 to. 6, 480,114",+7 (550) 507-2462,matveevnikola@rambler.ru,"a. Salsk, nab. Trinity, d. To 8/8. 57 470 699",27486,43324,M,221972,90660,1,
653,Eugene Sysoev Makarovna,"Art. Vladivostok, ul. Anniversary, d. 61, 460 986",8 220 171 91 27,sofon_73@rambler.ru,"n. Toksovo, bul. Green, d. 146 pp. 73, 711 788",24609,40993,F,,65904,,1
654,Mr. Dement'ev Kir Fadeevich,"a. Tolyatti, w. 60 years of the USSR, d. 3/1, 442 660",+7 (785) 917-9149,baranovapelageja@mail.ru,"Mr. Kulunda, nab. Suburban, d. 3, 299168",36787,41665,M,186876,80032,1,
655,Izyaslav A. Yakushev,"from. Magadan, trans. Rostov, d. 282, 096 641",+7 (776) 484-8243,mnikiforova@hotmail.com,"Art. Asha, trans. Station, d. 589 to. 9/1 695016",30300,42113,M,,111214,,1
656,Eugraph Gordeevich Shashkoff,"Art. Bronnitsy, nab. Teacher, d. To 7/5. 250, 554 871",+7 777 552 97 95,bsidorova@yandex.ru,"a. Nizhny Tagil, ALL. Azure, d. 6/9, 963 132",33062,43647,M,178191,89954,1,
657,Kudryashov Lyudmila Efimovna,"a. Kaluga, trans. Seaside, d. 15, pp. 677, 935 961",+7 (477) 835-8327,tihon59@hotmail.com,"from. Stary Oskol, etc.. Spartacus, d. 4, pp. 126, 750 828",27259,43314,F,,96960,,
