id,fullname,address,phone_number,email,workplace,birthdate,registration_date,gender,income,expenses,credit,deposit
264,Ivanna Valerievna Gordeeva,"COFO Kalach-on-Don, ALL. Tips, d. 892, 222 946",8 487 592 5676,ustin_1999@hotmail.com,"Art. Timashevsk, nab. Moscow, d. 87, 826 009",29786,43259,F,,88019,,
265,Bogdan Zhukov Avgustovich,"Art. Chikola, trans. Rileyev, d. 61 to. 913, 641 741",+7 (135) 479-5513,julija66@hotmail.com,"from. Dmitrov, st. Shock, d. 566, 977 037",29238,43756,M,,86295,,
266,Polycarp A. Nikiforov,"k. Yashalta, pr. Autumn, d. 884, 070 541",8 937 127 53 01,lebedevfoka@yandex.ru,"COFO Voskresensk, st. Working, d. 4/2, pp. 3, 020 327",36360,41622,M,114834,78378,1,
267,Ratibor Artemovich Nekrasov,"Ust-Dzheguta, nab. Pushkina, d. 3.8 pp. 71, 620 176",+7 760 118 41 54,kuprijan_13@hotmail.com,"a. Suzun, w. Starry, d. 618, 909 384",29255,43812,M,,74420,,1
268,Agatha Askoldovna Suvorov,"Mr. Chermoz blvd. Lilac, d. 907, 117381",+7 (833) 232-3496,marina_1989@yandex.ru,"d. Dubna, ul. High, d. 5, 905,745",27630,42936,F,,72353,,
269,Sazonov Iraida Veniaminovna,"from. Barguzin Str. Razin, d. 7, 543,001",+73661156261,parfen30@mail.ru,"COFO Obyachevo, pr. Cool, d. 843 to. 1 107 144",26471,41129,F,,87795,,1
270,Olympia Yevstigneyevich Silin,"d. Chebarkul, trans. Soviet army, d. 4, 637,468",8 (404) 064-3404,afinogen57@rambler.ru,"a. Suntar, bul. Azine, d. 95, 596 290",24024,42847,M,,98684,,
271,Zinovy ​​Frolovich Fadeev,"COFO Dvina, bul. Kiev, d. 331 pp. 18, 955 279",+7 (024) 446-2082,nikitanoskov@yahoo.com,"a. Baksan Str. 40 October, d. 3/8, 276489",35740,42623,M,,67995,,
272,Ms Volkova Antonin Leonovna,"Art. Moksha, w. Factory, d. 2.1 pp. 59, 958 926",+7 (366) 662-6214,vasilevaoksana@mail.ru,"a. Krasnogorsk (Mosk.), nab. Engels, d. 202, 557 318",31318,41836,F,293805,91534,1,1
273,Olympics O. Karpov,"d. Turukhansk, nab. Festivalnaya d. 86 p. 119, 326297",+7 (161) 651-3739,beljaevevstigne@mail.ru,"Yeniseisk, ALL. Metallistov d. 62 to. 135, 387 865",26248,42250,F,277069,78248,1,
274,Evdokia Valerievna Bolshakova,"a. Partizansk, ALL. Kotchubey, d. To 6/1. 4, 689,091",8 708 180 6803,shcherbakovsila@yandex.ru,"Belomorsk, w. Spring, d. 7 pp. 1/9, 385,194",35909,40964,F,160157,59887,1,
275,Tikhonov Cyrus Rubenovna,"n. Bomnak, trans. Nagorny, d. 45 p. 11, 300825",+7 (408) 090-7048,iraida72@mail.ru,"d. Sterlitamak, w. Snowy, d. 962, 352 268",26589,43640,F,,82795,,
276,Yemelyanov Juliana P.,"COFO Birsk, ALL. Volochaevskaya, d. 47, 948 734",+7 022 455 73 85,seliverstovlev@mail.ru,"n. Pushkin, w. Republican, d. 3/9, 076 332",36847,41733,F,295847,67054,1,
277,Vera Andreyevna Shilov,"d. Mezen, w. Pirogova d. To 7/9. 1, 279403",+7 (973) 787-24-12,ruslan39@mail.ru,"city ​​of Kurilsk, bul. Tselinny, d. To 6/7. 7 200515",30780,42664,F,,90992,,
278,Agafonov Catherine Antonovna,"Gatchina, w. Mechanical Engineers, d. 5/8 p. 4, 778,476",+74839337401,egorovaanzhelika@gmail.com,"Ioshkar Ola, pr. Industrial, d. 7 to. 412, 386 847",23202,43105,F,,74601,,1
279,Uvarova Oktiabrina Arkhipovna,"of Teriberka ALL. Nut, d. 7/6, 105318",8 (868) 264-2677,jakub_1999@rambler.ru,"a. Chernyahovsk, ALL. Krasnogvardejskaya, d. 2 k. 2 008 490",26813,43100,F,,67539,,
280,Trifon Edgardovich Markov,"from. Lodeynoye Pole, nab. Pushkina, d. 3 k. 9/6, 178172",8 (849) 674-10-53,savva1988@yandex.ru,"Istra, nab. Krasina d. 414 to. 88, 968 406",29932,40947,M,259998,85618,1,
281,Kuzmin Sava G.,"a. Clear (Orenbah.) ALL. Sportswear, d. 436 to. 16, 053 946",+7 (894) 132-92-70,belousovzahar@mail.ru,"COFO Kudymkar, bul. Saratov, d. To 8. 7 158645",29068,43622,M,,108523,,
282,Kharitonov Lyudmila Nathanovna,"Gorno-Altaisk, ALL. Tolstoy, d. 8/9, 618 985",88756806378,leonid_1994@yandex.ru,"n. Sorochinsk, w. Horticultural, d. 4, 724,581",36130,42159,F,,70529,,
283,Belousov Hippolyte Daniilovich,"Naberezhnye Chelny, nab. Red Banner, d. 782, 273 944",+7 738 919 70 40,polikarp1991@mail.ru,"Art. Soboleva, nab. Zoe Kosmodemyanskoy, d. 657, 605 476",22293,43741,M,105349,90776,1,
284,Bulls Maximilian Fomich,"n. Nadym, ul. Black Sea, d. 4/9 in. 221, 362 377",+7 902 260 10 39,titovanatalja@mail.ru,"Art. Kotlas, pr. Solochov, d. 58 p. 53, 072655",33942,40974,M,,116330,,1
285,Mikheev Dorofei Vsevolodovich,"a. Kotlas, w. Zaprudnoe, d. 3/3 p. 7/6, 201153",8 (477) 782-6048,nikiforovdobromisl@gmail.com,"Art. Chekhov Str. Komarova, d. 336 to. 605, 652 450",27731,43486,M,,72656,,
286,Kalashnikov Alla Tarasovna,"Ivanovo, bul. People, d. 205, 444 071",+7 835 132 73 23,samuil2011@mail.ru,"d. Chegem, pr. Orlovsky, d. 36, pp. 88, 278 026",24954,41882,F,,76424,,1
287,Comrade. Tretyakov Ladislav Aaranovitch,"a. Novgorod the Great, bul. May, d. To 7/1. 7, 934,279",+7 (184) 892-14-72,aleksandra53@hotmail.com,"Aleksandrovsk-Sakhalinsk, nab. Russia, d. 5, p. 3, 103,026",23238,41900,M,,80464,,
288,Konovalov Rostislav Marsovich,"COFO Uglich, w. Proletarskoye, d. 918 to. 505, 906 049",+7 797 410 04 31,saveli_01@yandex.ru,"in Tashtagol, nab. Minsk, d. 527, 943 735",26409,40942,M,,73297,,
289,Yemelyanov Milica I.,"n. Salsk, bul. Cheerful, d. 170 p. 5/7, 164 795",+7 443 597 16 87,gerasim_1996@rambler.ru,"COFO Krasnoural'sk, pr. Volkova, d. 139 pp. 546, 099 354",30230,41122,F,,72381,,
290,Agathon Ermilovich Panov,"from. Rainbow Street. Tula, d. 67, 096 999",88848811664,sharapovadam@hotmail.com,"from. Staraya Russa, ALL. Otradnaya, d. 9, 405 745",22090,43582,M,,79463,,
291,Tamara Y. Bobylev,"a. Beloretsk, trans. Filler, d. 72 p. 98, 481738",+72146029173,mihalovanatalja@gmail.com,"d. Moscow, nab. Gaidar, d. 7 k. 4/9 686870",32290,42297,F,289474,75476,1,
292,Boris Trofimov Avdeevich,"d. Suzun blvd. Cooperative, d. 15 to. 87, 608 853",8 (757) 240-15-69,rusakovdobromisl@hotmail.com,"Yeniseisk, ALL. Komarova, d. 4/5 in. 9/5, 732 561",36404,41661,M,165050,64959,1,1
293,Cyrus Davidovich Isakov,"Nizhnevartovsk, nab. Z.Kosmodemyanskoy, d. 41, 466 195",8 728 999 80 14,jpanfilova@yahoo.com,"Mr. Jurowski, ALL. Maxim Bitter, d. 7 to. 22, 616 742",30961,41565,M,,85458,,
294,Likhachev Hope Askoldovna,"n. Lotoshino blvd. Blucher, d. 9/9 in. 1/2, 313 204",8 (187) 280-4352,valentin20@yahoo.com,"from. Dalmatovo, bul. Berry, d. To 745. 7 786 486",26663,43166,F,170275,75794,1,
295,Afanasiev Nikon Efimevich,"COFO Ust-Kalmanka, nab. Poplar, d. 3 to. 4, 865,395",+7 (843) 599-5887,arseni_87@hotmail.com,"Art. Uglich, nab. Yenisei, d. 5/8 p. 8/8, 446371",31068,41607,M,,128003,,
296,Sinklitikiya Zakharovna Mukhina,"COFO Psebay blvd. Transverse, d. 55, 695 509",80250735561,naum1973@yandex.ru,"Verkhoturye, etc. Oktyabrsky, d. 572, 819 042",31578,41727,F,129582,78509,1,
297,Shilov Emilia Timofeevna,"n. Kiren, pr. Khutorskoi, d. 1/3 in. 506 475 447",+7 (034) 373-85-98,noskovgorde@gmail.com,"a. Uchalu, nab. Novoselskaya, d. 58 pp. 511, 393 826",27047,41621,F,193841,75829,1,
298,Mironova Valentina,"d. Yurievets (Ivan.), str. Matrosov, d. 1 p. 9/4, 050,230",86150607248,anatoli56@hotmail.com,"n. Vnukovo (meteost.), bd. Building, d. 48, 795 199",30531,43207,F,,80687,,1
299,Shilov Vseslav Frolovich,"a. Makhachkala, ALL. New, d. 331 in. 7 611 067",+7 483 517 80 53,orlovsimon@mail.ru,"a. Votkinsk, ALL. Bazhova, d. 2 p. 64, 312128",26397,41246,M,,72971,,1
300,Dobromyslov Feodosevich Belyaev,"d. Barnaul, ALL. Krasina d. 5 to. 46, 112298",+7 (888) 731-77-81,natan2018@mail.ru,"from. Buynaksk, pr. Comintern d. 665 to. 126, 345 408",36944,41452,M,242417,73546,1,1
301,Igor G. Fomichev,"COFO Olenek, w. Volochaivs'ka, d. 420 to. 621, 350 157",8 (940) 189-8787,petuhovaalina@hotmail.com,"a. The peace, etc. Quiet, d. 1/9, 640 814",22459,43115,M,232930,89633,1,1
302,Lobanov Xenia Zakharovna,"COFO Arkhangelsk, pr. Lunar, d. 4/7 in. 599, 116 239",+7 (924) 352-3744,aristarh61@yahoo.com,"Art. Obyachevo, nab. Kol'tsov, d. 2 423 540",29598,41727,F,,87888,,
303,Vadim Lapin Anisimovich,"Vereschagino (Perm.), nab. Nekrasov, d. 4, 862,671",+7 (863) 857-20-41,semenbespalov@rambler.ru,"COFO Bavly ul. Red Partizan, d. To 54. 9, 873 955",33498,41393,M,,87886,,
304,Timothy V. Gorbachev,"n. Kostroma, bul. Kommunarov d. To 82. 4/2 502123",8 (597) 871-7290,wsmirnov@hotmail.com,"a. Ramenskoye, nab. Sun, d. 12, p. 6, 099,571",25238,42910,M,,73922,,
305,Frolov Mily Adamovich,"Art. Tom, ave. Shcherbakova, d. 97 p. 69, 506488",+7 (955) 005-7601,panfilovsolomon@mail.ru,"COFO Bay, ave. Kosmodemyanskoy, d. to 562. 3 553 482",36798,41724,M,,78984,,
306,Bolshakova Zinaida G.,"Novy Oskol, w. Municipal, d. 4 135790",+78659072826,bobilevazoja@yandex.ru,"COFO Rostov, bul. Youth, d. 9/2 to. 2 628 476",30833,43518,F,,88715,,1
307,Fedorov Elisha G.,"n. Severo-Kurilsk, trans. Tomsk, d. 417 pp. 133, 461 878",8 035 708 6144,valerimarkov@yahoo.com,"from. Tsimlyansk, bul. Halturina, d. 9 k. 581, 530 657",29246,41609,M,246247,79481,1,
308,Ms Pestova Iraida ANTONOVNA,"Samara, pr. Gastello, d. 62, 560094",+7 (041) 139-5969,mihe_1997@yahoo.com,"Monchegorsk, w. Volkova, d. 36, pp. 96, 607 821",26865,43218,F,,83595,,1
309,Kasian Denisovich Ignatiev,"from. Taldom Str. Gromov, d. 7 pp. 2 476 798",+7 575 744 5895,marfa_1970@yandex.ru,"Art. Yaksha, bul. Bryansk, d. 5/5 in. 27 722 282",31002,43125,M,,119106,,
310,Zhukov Milica L.,"Troitsk (Mosk.), trans. Zhukova. Page 6/4. 3/2, 829 461",+7 (918) 725-2446,ziminadarja@rambler.ru,"Viluysk blvd. Surikov, d. 5, 710,834",22025,42894,F,,85217,,
311,Rusakova Larisa Arkhipovna,"a. Sortavala, nab. Teachers, d. 9/6, 448532",8 948 980 9553,tihon87@mail.ru,"a. Irbit, trans. Thieves, d. 5, 191140",24324,42553,F,166506,102087,1,1
312,Strelkova Fevronija Kirillovna,"d. Chegem, pr. Tall, d. 41, 203 187",+7 114 099 6081,zikovermola@rambler.ru,"d. Syktyvkar, w. Industrial, d. 7 to. 857, 478332",28382,41815,F,,99937,,
313,Fomichev Claudius Zhoresovich,"COFO Tulun, bul. Spataka, d. 80 k. 6/5, 731,144",+7 (339) 735-06-24,borisovdenis@rambler.ru,"Art. Ulyanovsk, pr. Olympic, d. 77 pp. 9, 022 735",30891,41277,M,,64933,,1
314,Zaitseva Thekla Kirillovna,"Art. Nyazepetrovsk, pr. Pioneer, d. 806, 905 123",+7 643 874 72 84,prohor_85@rambler.ru,"d. Buzuluk, nab. Makarov, d. 5/1, pp. 43, 270 864",29147,43144,F,,89525,,1
315,Uvarova Galina Arkadievna,"a. Nartkala Str. Pugachev, d. 3, p. 55, 502200",89040773451,ziminaalla@hotmail.com,"a. Bottom, Naberezhnaya. Semashko, d. 11, k. 67, 245492",36007,41531,F,,69449,,1
316,Bulls Nazar Adrianovich,"Vyazma, bul. Bitter, d. To 5/3. 5, 778,662",+7 (080) 607-03-16,oershova@rambler.ru,"d. Kashira, nab. Ogorodnaya, d. P 1/5. 6/5, 172173",23896,42934,M,,102288,,1
317,Scherbakov Valentina,"of Kushchevskaya, w. Land reclamation, d. 3/4 pp. 242, 387 624",+7 100 438 4967,nikola1971@rambler.ru,"from. Dzhubga, ul. Slavic, d. 474 to. 665, 621 606",24559,41155,F,,105005,,1
318,Larisa Feliksovna Dorofeeva,"n. Kushchevskaya, bul. Scherbakov, d. 277 to. 1 983 527",+7 654 651 76 44,aleksandr88@rambler.ru,"n. Tomsk, ALL. Soviet, d. 4 k. 3/2 476114",27796,41177,F,,92811,,
319,Marina Romanova Uvarova,"n. Kislovodsk Street. Shaumyana, d. 387 to. 18, 489 699",+7 086 435 05 07,shilovaantonina@hotmail.com,"n. Izhevsk, pr. Pirogova d. 4 to. 39, 944 242",31987,43735,F,159958,83828,1,1
320,Ruben Evseevich Fokin,"from. Bologoye, nab. The station, d. 71 p. 7 207151",8 084 209 9887,davidovanadezhda@gmail.com,"a. dunk, nab. Tomsk, d. 712 to. 9/7, 116518",23147,41477,M,,102635,,
321,Titov Boris V.,"COFO Apsheronsk, ALL. Deadlock, d. 6/5 in. 9/5, 175 569",8 (751) 287-31-22,antonovevgeni@yahoo.com,"from. Great Luke, per. Bazhova, d. 633 p. 145, 315152",30201,43731,M,289954,82430,1,
322,Poles Trofim Dem'yanovich,"n. Sharia, w. Privolnoe, d. 6/9 in. 6/7 244441",+79052941165,litkinevgeni@yandex.ru,"Mr. Schelyayur, trans. Gafuri, d. 4/4, 323011",22466,43153,M,,71517,,1
323,Kononov Orestes E.,"from. Kizhi, w. Razin, d. 5, 159003",+7 (551) 915-85-78,boriskorolev@mail.ru,"Sterlitamak, st. Vakhitov, d. 7 to. 8, 278 213",35704,43245,M,,67555,,
324,Shiryaev Arkhip Iosipovich,"Mr. Kataysk, ALL. Puteyskaya, d. 5 pp. 4/1 496776",8 180 267 1829,sitnikovkuzma@hotmail.com,"Obojan, nab. Komarova, d. 99 p. 880, 316222",34817,43466,M,,82311,,1
325,Kharitonov Vitaly Vlasovich,"Art. Rossosh, nab. Mekhanizatorov d. 34 pp. 259, 570 213",+7 109 807 1126,tvorimirfrolov@rambler.ru,"of Krasnoufimsk, bul. Student, d. 761, 579 638",35922,41341,M,,66606,,1
326,Gusev Longin Fomich,"Art. Kemerovo, ALL. Voroshilov, d. 62 to. 112, 101 043",+7 922 320 0558,kopilovljubim@yandex.ru,"d. Nizhnekamsk, trans. Corner, d. 6/8, 264 176",26304,41315,M,269297,107793,1,1
327,Fedotov Gavrilovic Socrates,"Art. Chikola, ALL. City, d. 8/7, 699 459",+7 328 079 5529,kolobovfeoktist@yandex.ru,"d. Tyumen, bul. Tomsk, d. To 1/2. 7, 030,278",29292,41712,M,,90796,,
328,Faina Borisovna Samson,"from. Gorodovikovsk, w. Cheremuhovo, d. 3 to. 425, 990 331",+7 333 980 08 41,petuhovanatoli@yahoo.com,"from. Vitim, w. Federal, d. To 587. 7 715 810",22498,42620,F,,78045,,
329,Filippova Laura Andreevna,"d. Oha, pr. Kharkov, d. 58, 892 423",8 (247) 571-25-26,zhuravlevkim@mail.ru,"d. Ust Ishim pr. Parkovy, d. 60 to. 777, 611 742",31392,43250,F,,65427,,
330,Tikhonov Thekla S.,"COFO Surgut (Hunt.), co. Ul'yanova, d. 7 pp. 7/6, 025,340",8 688 232 46 38,ratmir1975@rambler.ru,"n. Oktjabrskiy (Bash.) ALL. Nikitin, d. 4/2 p. 1, 627,779",32953,41319,F,,97095,,
331,Blokhin Angelina V.,"d. Asbestos pr. Ordjonikidze, d. 423, 462830",8 (396) 702-0022,ivan_2008@hotmail.com,"COFO Nizhny Tagil, ALL. Neva, d. 703, p. 6, 979,523",35996,41052,F,,71316,,
332,Kotova Praskovja Zakharovna,"COFO Ekaterinburg, ul. Komarova, d. 3/7 p. 2/1 374006",+7 (227) 117-1560,shirjaevmark@gmail.com,"from. Birobidzhan, bul. Lenin, d. 192, 695 326",26420,43597,F,,68720,,
333,Ryabov Glafira Pavlovna,"from. Lips, etc.. Large, d. 5/1 in. 435 078 423",8 (465) 181-91-91,judinbudimir@yahoo.com,"d. Silver Ponds, ALL. Cheryomushki, d. 612, 688 631",31680,43759,F,,71018,,
334,Juvenal Eremeevich Seleznev,"Mr. Neplyuevka Str. Kosmodemyanskoy, d. 7, p. 72, 142372",8 493 410 7826,stanimir_77@rambler.ru,"Art. Norilsk, w. Linear, d. 5/4 in. 333, 620 914",35800,43672,M,,80645,,1
335,Savvaty Fedorovich Subbotin,"Mr. Obyachevo, ALL. Zhukov, d. 6/8 in. 39 055 585",8 869 543 78 23,ignativinogradov@yandex.ru,"a. Kasimov, nab. Thalmann, d. 2/5 in. 835, 275 200",36151,41289,M,,84441,,1
336,Popov Euphrosinia D.,"n. Nizhnekamsk, trans. South, d. 34 857 482",8 520 131 56 58,fedot_11@mail.ru,"Mozhaisk, w. Krasnoflotskoye, d. 532, 508 191",34784,43672,F,,77501,,
337,Vladimir G. Kovalev,"Art. Salavat Street. Novoselov, d. 7, 756,921",+7 726 080 9941,ashubin@hotmail.com,"COFO Volhov Str. Youth, d. 5 in. 9/9, 412738",33066,42195,M,271481,93212,1,1
338,Baranova Lukiya Nilovna,"g Dzheirakh, pr. Pioneer, d. 5, p. 6, 481,067",+7 (208) 501-06-63,sofon50@hotmail.com,"d. Ust-Dzheguta, ALL. Field, d. 1, 600568",37412,41424,F,,78966,,
339,Natalia Makarova,"Arkhangelsk, bul. Smirnova, d. 306, pp. 39, 104 576",8 (810) 924-3242,oleg_09@yahoo.com,"COFO Kudimkar, pr. Volkova, d. to 8. 7 329376",22705,43211,F,,87618,,
340,Svetlana Koshelev,"n. Seimchan blvd. Scherbakov, d. 9, 593752",+7 693 775 6257,uljan_36@mail.ru,"COFO Tulun, trans. Belinsky, d. 45 p. 5, 068,262",30500,42770,F,266947,97716,1,
341,Eugene Nikonov Kirillovna,"n. Azov (Rost.), bd. Seaside, d. 8 pp. 4/5, 274,122",8 426 728 74 82,anike2011@mail.ru,"Art. Plesetsk, bul. Club, d. 9, 703 034",24209,41456,F,,96153,,1
342,Petr Dorofeev Cheslavovich,"a. Sharia, ALL. Pavlova, d. 4, p. 471, 140430",8 888 663 9407,loginovbazhen@hotmail.com,"Art. Taldom, ave. Borovoj, d. 60 pp. 9, 004 288",30506,42371,M,,117048,,1
343,Claudia Timurovna Orlov,"COFO Onega embankment. Hope, d. To 2/4. 86 028 839",+73958806152,silvestrevseev@yahoo.com,"from. Pevek, bul. Yeniseisky, d. 6 pp. 951, 852 608",27443,42180,F,,92539,,
344,Bobylev Galaktion Izotovich,"Art. Hype, nab. May 9, d. 39 pp. 34, 503 383",8 (212) 806-37-51,zikovtihon@hotmail.com,"from. Pavlovsky Posad, trans. Locomotive, d. 5 to. 32, 241 102",22810,42106,M,,75692,,
345,Sofia Haritonovna Ignatov,"Art. Zhigansk, ALL. Krasnogvardejskaya, d. 9, 907 625",+7 (124) 771-55-28,gurevstojan@hotmail.com,"Art. Yuryuzan, trans. Mill, d. 8/7, 215 389",28923,41910,F,162208,73584,1,
346,Medvedev Plato Dorofeyevich,"COFO Urengoy ALL. Emb. To 4/1. 4, 584,075",+7 (330) 454-57-36,titovmechislav@rambler.ru,"COFO Yurievets (John.), Str. Pine, d. 54, 289 639",23589,41844,M,112285,81655,1,
347,Emilia G. Lytkina,"d. Borzya lane. Distinct, d. 452 p. 4, 838,921",+7 (258) 494-6695,gerasimvladimirov@hotmail.com,"from. Odintsovo, trans. Plehanova, d. To 2/1. 44 960 552",36916,42426,F,,86115,,1
348,Kozlova Raisa Pavlovna,"from. Lips, bul. Bazarnyi, d. 36, 492 692",8 (384) 272-8874,vikenti30@rambler.ru,"d. Kamensk-Uralsky, trans. Vavilov-, d. To 1/4. 97 784 660",30486,42076,F,,85726,,
349,Spiridon Yaroslavovich Lazarev,"a. Ershov, co. Vakhitov, d. 835 p. 4, 149,588",8 (349) 840-4509,erofe1973@yandex.ru,"Art. Amderma, bul. Spataka, d. 3, p. 7, 713,736",25904,43210,M,190174,71542,1,1
350,Raisa Valentinovna Shashkova,"Art. Ukhta, trans. Voroshilov, d. 1, 227975",87574530512,prohorovmoise@yahoo.com,"a. Khabarovsk, nab. October, d. 65 in. 478 852 423",22199,41332,F,,76952,,
351,Julius Ignatovich Fomin,"Gubkin, etc. Bright, d. 5/5 p. 8/3, 610 559",+7 (162) 280-3513,kiselevgerman@hotmail.com,"Aleksandrovsk, nab. Guards, d. 625, 998 178",30232,42262,M,197919,80144,1,
352,Nathan Dorofeyevich Fedotov,"from. Zaraysk, ALL. Red Partizan, d. To 2/1. 8, 974 999",+77549438195,safonovamos@yahoo.com,"Korolev, st. Reclamation, d. 5 pp. 550, 756 264",22806,43075,M,,64370,,1
353,Nathan V. Kozlov,"Mr. Yashkul Str. Bitter, d. To 1/8. 5, 217,810",+7 (229) 305-2776,bogdan_83@yandex.ru,"from. Ojmjakon, pr. Peace, e. To 6. 86, 264 775",24406,42543,M,,69542,,
354,Naumov roots Evseevich,"n. Batamay, pr. Basil, d. 47 p. 8/1 663979",8 432 051 00 76,grigori1998@rambler.ru,"COFO Kudymkar, nab. Chervonoarmijska, d. 6 k. 4/3 502576",35384,42523,M,215938,97542,1,
355,Raisa Belova Artemovna,"d. Kizilyurt, trans. Krasnoyarsk, d. 747 pp. 741, 837 929",+7 (294) 519-84-52,antip_17@hotmail.com,"from. Dzheirakh, pr. Razin, d. To 8. 2/6, 738,290",29379,43325,F,,56443,,
356,Dmitrieva Emilia Pavlovna,"d. Kurganinsk, street. Schetinkina, d. 598 p. 718, 114324",+7 (252) 323-0239,mamontovaalina@yahoo.com,"d. Yaksha Str. Minin, d. 8, 537 677",26050,43823,F,205329,97998,1,
357,Daria Nikolaeva Arkadievna,"a. Boguchar, w. Kiev, d. 6, 511,401",+7 (181) 886-01-61,emilija_1986@rambler.ru,"Moscow, pr. Enlightenment, d. 97 in. 42 872 918",35960,43819,F,,86480,,
358,Photios Borislavovich Terentyev,"n. Krasnodar, w. Lermontov, d. 179, 753 853",8 (984) 231-24-72,ovchinnikovkondrati@gmail.com,"Art. Bugulma, nab. Volkova, d. 6 pp. 9/9, 201680",25483,43308,M,227209,89534,1,1
359,Nonna Naumovna Gordeeva,"Mr. Nyazepetrovsk, trans. Road, d. 44 to. 73, 688 368",+7 (433) 933-28-78,moiseevisa@hotmail.com,"Art. Shadrinsk, ALL. Deadlock, d. 6/8, 629028",31080,41291,F,,69109,,
360,Lazareva Larisa Pavlovna,"COFO Zabaykalsk, trans. Cul, d. 58, 910 686",+7 (279) 743-84-91,grishinkarl@yahoo.com,"of Tomari, trans. Socialist, d. 556 to. 6, 376146",31682,43647,F,194012,97233,1,
361,Innocent Denisovich Pestov,"d. Vladimir, ALL. Shore, d. 8/3 pp. 505, 169 231",8 (957) 710-8477,gordeevamargarita@yandex.ru,"COFO Troitsk (Mosk.), nab. Timiryazev, d. 185 to. 1/6 259381",32378,41737,M,,83792,,
362,Kolesnikov Vasilisa Askoldovna,"COFO Wedge, nab. Bitter, d. 7 to. 140, 925 883",+7 (725) 894-6221,milan_49@rambler.ru,"n. Anadyr, nab. School, d. 2.1 pp. 18, 566 945",24929,41230,F,,79376,,
363,Tvorimir Benediktovich Morozov,"COFO Dzhubga, ALL. Neva, d. 4 483328",+70494867957,noskovamaja@yandex.ru,"Art. Solovki, ALL. Winning, d. 4/3 in. 316 542 816",31522,40966,M,205447,91444,1,
364,Narkis Yulianovich Yudin,"a. Forest (Sverd.), co. 1 Maya, d. To 4/5. 877, 155705",87260129929,maslovsolomon@yahoo.com,"Art. Bronnitsy, trans. Park, d. 45 to. 73, 672 124",35356,42768,M,,87393,,
365,Angelina Anisimova Veniaminovna,"a. Find, nab. Chelyuskintsev d. 58, 240 060",85876301111,ipatgavrilov@yahoo.com,"COFO Kirensk, nab. Maritime, d. 585, 168049",27116,43350,F,,100890,,
366,Evdokim Filimonovich Lavrentiev,"The bottom of emb. Glinka, d. 2/4 p. 31, 168780",8 537 784 62 58,braginivan@yandex.ru,"n. Ust-Kalmanka, w. Festivalnoe, d. 2/9 in. 589, 054 845",22037,42240,M,,94561,,1
367,Maria Sharapova Yulyevna,"d. Malgobek, trans. Professionals, d. 9, 491 810",84935096163,visheslav2007@yandex.ru,"from. Malgobek, w. Tambovskoe, d. 3/1, pp. 7, 261484",28362,41975,F,,86880,,1
368,Lukyan Trifonovich Kudryashov,"d. Rainbow, nab. 8 Marta, d. 4/6 in. 760, 252265",8 125 893 2024,osipovanatoli@mail.ru,"Muravlenko, bul. Grandma, d. 8/9, 963 775",27753,41838,M,,74566,,
369,Afinogen Glebovich Panfilov,"Zvenigorod, etc. Suvorov, d. 5 p. 2/7, 265 979",81980887148,nikola_15@hotmail.com,"from. New Urengoj, pr. Vokzal'na, d. 5/2 in. 408, 282 838",37178,41546,M,,87831,,
370,Veselov Czeslaw Arsenovich,"COFO Rubtsovsk, ALL. Olympic, d. To 6/4. 3/1, 125,225",8 742 421 09 61,averjan_81@yandex.ru,"COFO Novomichurinsk, nab. Black Sea, d. 18 to. 33, 258557",23877,42729,M,,79297,,
371,Mokey Feodosevich Afanasiev,"Art. Suzdal Str. Apricot, d. 9/3, pp. 610, 830 797",8 (120) 072-8462,ckolesnikov@yandex.ru,"d. Barguzin, nab. Martha 8, d. 37, 409 764",28183,42909,M,,87822,,
372,Eduard Rusakov Tarasovich,"Art. Mineralnye Vody, trans. Dokuchaev, d. 8/1 in. 908 307119",+7 174 865 70 64,lebedevpolikarp@rambler.ru,"n. Kimry Str. Student, d. 7/2, pp. 7, 428437",26647,41730,M,210743,107384,1,1
373,Rogov Anastasia Arkhipovna,"from. Maikop, nab. TBN, d. 1 k. 42, 028 712",8 (592) 266-39-17,oktjabrina2009@mail.ru,"Inta, w. Zaovrazhnaya, d. 6/4 in. 2/4, 308307",23569,42064,F,228899,108486,1,
374,Orlov Sigismund Izotovich,"n. Kataysk, nab. Soviet,. To 12. 1/6 032883",8 521 294 5634,frol60@yandex.ru,"d. Vyazma, ALL. Railway, d. 260 pp. 25, 181 552",37607,43245,M,,86756,,
375,Ephraim Emilia Oskarovna,"d. Sukhinichi Str. Mechanical, d. 570 to. 46 964 705",8 (248) 483-6289,tatjana_2016@mail.ru,"Art. Kemerovo, ALL. Sadovaya, d. 7/1, pp. 38, 834 183",34110,43823,F,113235,61537,1,
376,Zoe Kuzminichna Avdeeva,"COFO Kirensk, ALL. Suburban, d. 4 221360",8 946 469 43 92,osipovladislav@gmail.com,"a. tulpan river, w. Podlesnoe, d. 165, 872 522",33011,42966,F,,84194,,
377,Tarasova Maria L.,"Art. Ussuriysk, pr. Azina, d. To 5/4. 5/2 370460",+77369126022,jakushevostap@yahoo.com,"Art. Kostomuksha, w. Pirogova d. 72 p. 1/8, 071,582",36435,42901,F,,104481,,1
378,Nazarov Pancrate T.,"d. Kolomna, bul. Azovskiy, d. 17, 374 792",8 (240) 273-00-15,pavlovsevastjan@mail.ru,"Host COFO, pr. Kotchubey, d. 7 to. 84, 383956",32809,43684,M,,68371,,
379,Anisim Arkhipovich Karpov,"COFO Kashira, trans. Leo Tolstoy, d. 5/6, 027 473",81269133736,elizaveta_57@gmail.com,"n. Makarov, w. Crimean, d. 7 pp. 9, 845 335",33763,43261,M,,78322,,1
380,Dementiy Arsenovich Stepanov,"n. Argayash, trans. Club, d. 344 to. 8, 229 458",8 893 401 1465,teterinkuzma@yahoo.com,"d. Aleksandrovsk, w. Matrosov, d. 54 p. 5, 788,897",27655,42642,M,,103287,,
381,Sazonov Nathan Vilorovich,"n. Kurumkan, pr. Turgeneva, d. 55 p. 6/1 934483",+7 064 974 0880,shashkovavalerija@yandex.ru,"Zlatoust, st. Herzen, d. 49, 164 145",30472,40937,M,103451,82636,1,1
382,Karl Y. Kirillov,"n. Nizhny Novgorod, w. Esenina, d. 2/3 592125",+7 (621) 277-1947,vladlen88@mail.ru,"from. Torzhok, ul. Fraternal, d. 9/3, 065 271",37651,42125,M,118283,78490,1,
383,Callistratus Kharlampovich Zaitsev,"n. Aleksin, w. Mendeleyev, d. 7, 800,454",+7 (224) 258-1577,fominbronislav@yandex.ru,"COFO Kurtamysh, pr. Pirogova d. 696 pp. 170, 863 156",30369,41182,M,,121517,,
384,Antonina Bogdanova Yulyevna,"Sasovo, bul. Papanin, d. 825 to. 5/4, 101 408",+7 (883) 411-43-82,gostomisllitkin@mail.ru,"n. Shelehov blvd. Sverdlov, d. 37 p. 99, 662372",25651,41075,F,,88571,,
385,Nadezhda Aleksandrova Rudolfovna,"COFO Pskov, st. Lermontov, d. 887 to. 1 380 813",84622439621,gerasim1989@rambler.ru,"n. Balashikha, sh. Pioneer, d. 51, 166275",36884,42518,F,286983,88049,1,1
386,Sidorova Maria Nikolaevna,"from. Pechora, w. Wide, d. 9/2 in. 162 793 588",8 (392) 274-7924,shilovaoksana@rambler.ru,"a. Ust-Ishim, etc. Chelyuskintsev, d. 2/4 in. 914 707 643",25366,41177,F,,84727,,
387,Benedict Edgardovich Melnikov,"d. Hassan, w. Poor Damian, d. 611 pp. 90, 796 004",+7 684 932 2075,mihe2003@yandex.ru,"Olenegorsk (Yakutia.), Str. Home, d. 6 in. 2/3, 062 562",28204,43398,M,,71548,,1
388,Hope G. Koshelev,"a. Chernyahovsk blvd. Krasnodar, d. 885 to. 76, 131673",8 133 959 9637,arseni_1998@hotmail.com,"g. Roslavl Street. Uritskogo d. To 35. 9/6, 260,070",31665,42490,F,,103731,,
389,Artem V. Ponomarev,"COFO Orsk, bul. Labor, d. 7/6, 782 421",+75820146009,terentevavasilisa@mail.ru,"from. Yuzhnouralsk, ALL. Youth, d. 8 215 716",35018,42062,M,139037,95096,1,
390,Nikon Fedoseevich Zhukov,"Art. Belgorod, ul. Zhukov, d. 6 k. 171, 802 668",86632214992,zkulikov@mail.ru,"Art. Yurovsky, bul. Road, d. 96 p. 6, 660,856",31085,43393,M,208038,96153,1,
391,Oia F. SELIVERSTOVA,"Lagan, pr. Stavropol, d. 572 p. 5, 039,492",8 (651) 215-00-45,jakovlevsimon@hotmail.com,"Art. Peaceful, ALL. Lower, d. 5/7 in. 570 959 800",31296,43052,F,182350,80976,1,1
392,Alina Fedorova Maksimovna,"from. Abakan, ALL. Razin, d. 56 to. 50, 549 422",+79538748164,gromovaveronika@yandex.ru,"d. Usolye Siberian, ALL. Day, d. 2 to. 3 317 329",31712,43127,F,,85664,,1
393,Alexander A. Sharov,"d. Troitsk (Mosk.) ALL. South, d. 5/7, 515 023",+7 (278) 572-19-77,zhdanovkondrati@gmail.com,"a. Sosnovy Bor, w. Large, d. 185 p. 3, 483,369",34715,42324,F,,84314,,1
394,Agatha Naumovna Sazonov,"from. Zhigulevsk, nab. Driving, d. 7/5 in. 9/1, 160 331",8 (458) 564-93-68,mstislavpetuhov@yandex.ru,"a. Usman, w. Kuznetsk, d. P 2/8. 1/5, 938,684",26363,41182,F,,84787,,1
395,Anikei Teimurazovich Kryukov,"n. Cheremhovo, ALL. Mechanical, d. 424 to. 50, 231 475",+7 (866) 544-8850,egor_1986@gmail.com,"from. Kamensk-Uralsky, ALL. Installers, d. 4 to. 447, 218 595",23035,41422,M,,77852,,
