id,fullname,address,phone_number,email,workplace,birthdate,registration_date,gender,income,expenses,credit,deposit
658,Kseniya Osipova Pavlovna,"COFO Andreapol blvd. Slavic, d. 7/3, 138023",8 440 515 8413,poljakovfedor@yahoo.com,"d. Sergiev Posad, pr. Tsetkin Clara, d. 91 k. 6/5, 639,375",24383,41629,F,167793,93791,1,1
659,Agatha Danilovna Maslov,"n. Voronezh, bul. Snow, d. 399 p. 8/2, 917 450",+7 682 593 10 42,aleksandra_64@hotmail.com,"Ryazan, w. Vatutin, d. 4/6 in. 894 130 731",32342,42928,F,,83198,,
660,Raisa Rusakova,"COFO Okhotsk, bul. Kolkhoz, d. 577, 206967",+7 (503) 674-7926,bolshakovanonna@yahoo.com,"n. Priosersk Str. Rosa Luxemburg, d. 48, 643 441",27473,43362,F,,87782,,
661,Ishmael Danilovich Chernov,"a. Poyarkovo, trans. Bulk, d. 7/8, 673 248",+7 868 144 9989,zoja_69@gmail.com,"Art. Balaam, w. Aspic, d. 1 062 543",23890,43177,M,199751,76893,1,
662,Koshelev Leo Fokich,"from. Operate, pr. Labor, d. 4/3 p. 7, 859,131",8 (175) 402-60-25,natan_1985@hotmail.com,"n. Usman, pr. Siberian, d. 9/3, 554,569",29270,42452,M,,102330,,
663,Claudia Simon Boleslavovna,"a. Taishet, w. Komarova, d. 94, 833 783",8 (320) 113-07-13,martjan1972@gmail.com,"a. Severouralsk, nab. Sand, d. 5/1 052331",35864,43521,F,,66358,,
664,Alevtina Kuznetsova Vladislavovna,"n. Tompa, ALL. Shady, d. 489 to. 47 729 324",+72106551959,nikodim_08@yahoo.com,"Art. Bodaibo, ALL. Puteyskaya, d. 3 to. 89, 234690",33282,42886,F,239508,73184,1,1
665,Groin T. Zakharov,"Art. Bottom, bul. Work, d. 7, p. 100, 131957",+7 374 191 7450,vasilisa2010@rambler.ru,"a. Shamar, bul. Pasture, d. 8, 076 551",37357,42927,M,207601,69503,1,1
666,Guryev Proclus Matveevich,"d. Obninsk, pr. Steppe, d. 5 pp. 30, 155 431",8 852 581 42 59,lukija_64@yandex.ru,"n. Kalachinsk, w. Bridge, d. 148 pp. 559, 263 028",30533,43345,M,,79749,,
667,Bobylev Lyubosmysl Vilorovich,"from. Valdai, bul. Club, d. 91 in. 5/9, 329 677",84205609575,mechislav_1983@yandex.ru,"from. Kabansk, ALL. Frunze, d. 7 k. 2 752 438",28581,43572,M,,64147,,1
668,Selivan Zhanovich Doronin,"Mr. Whalen Street. Sovkhoznaya, d. 7/2 in. 987 903 693",+74208929625,varfolome_33@rambler.ru,"n. Gelendzhik, w. Steppe, d. 9/9 in. 6/3, 752 791",26508,41252,M,164563,72018,1,1
669,Victoria V. Panova,"Yeniseisk, trans. Sakhalinsky, d. 1/8 p. 1, 724,696",+79204854003,azarigalkin@yahoo.com,"d. Smolensk, w. Port, d. 5 k. 5/4 876197",28734,42676,F,291262,104722,1,
670,Sofia Oskarovna Emelyanova,"d. Ryazan, w. Settlement, d. 3, 453,267",+71776378451,julija2000@rambler.ru,"Rubtsovsk Str. Lazo, d. 97 k. 5/6 160361",24793,43158,F,183399,86751,1,1
671,Tsvetkova Tatiana Pavlovna,"Art. Kolomna, etc.. Kochubey, d. 88, 768 784",8 (293) 846-70-73,haritonchernov@gmail.com,"n. Ishim Street. Voykova, d. 2 p. 68, 210200",25163,42625,F,107049,90384,1,1
672,Victoria Fomina Kuzminichna,"Chebarkul, ul. Fizkulturnaya, d. 39 to. 3 946 109",8 (245) 255-95-00,olimpinikonov@rambler.ru,"d. Shelagontsy blvd. Borovoj, d. 9/7, pp. 2, 315695",30283,43676,F,229038,104548,1,
673,Ms Shubina Emilia F.,"Art. Kaliningrad, trans. Bulk, d. 303, 111 728",8 (754) 426-8771,moise_1972@yandex.ru,"a. Severouralsk, bul. Krasnogvardejskiy, d. 8 pp. 54, 888 439",36848,43075,F,,70742,,1
674,Semenova Anna A.,"COFO Novy Oskol, etc.. Odessa, d. 370 p. 3/6, 720 019",+70975262223,birjukovtihon@rambler.ru,"n. Istra, ALL. Red Army, d. 9/6, 077 033",29160,41050,F,157699,56103,1,1
675,Titus V. Sergeev,"n. Kizhi, nab. Working, d. 63, 140206",+7 427 118 43 22,kornil1973@yahoo.com,"d. Volokolamsk, trans. District, d. 46 pp. 481, 157 042",27315,42409,M,,92985,,
676,Eupraxia Svyatoslavovna Filatova,"n. Alapaevsk, pr. Spa, d. 76 p. 6/7 686371",8 419 363 53 73,zikovvjacheslav@yahoo.com,"COFO Ash Street. Lilac, d. 71 to. 1 345 341",33203,41843,F,,77364,,
677,Sylvester Trofimovich Mamontov,"Petuhovo, nab. Maple, d. 7, p. 6, 812,331",+73004177560,lebedevapraskovja@gmail.com,"Birobidzhan, trans. Minsk, d. 964 to. 6/3, 688 800",25965,42231,M,,69035,,
678,Roman Kulakov Efstafevich,"d. Chermoz, trans. Bolshevik, d. 634, 233 188",8 (716) 573-62-00,luka_1977@mail.ru,"COFO Izberbash, pr. Seaside, d. 4 k. 3/4 496991",24057,43318,M,149579,88743,1,1
679,Sinklitikiya A. Yemelyanov,"a. Pushkin Str. Sedova, d. 6/3 p. 9, 757 269",+7 935 640 50 01,bazhen1971@yahoo.com,"COFO Kolpashevo, nab. Lazo, d. 99 p. 91, 168722",29330,41349,F,194233,66404,1,
680,Taisiya Zakharovna Popova,"from. Kimry, pr. Bridged, d. To 6. 16, 249 064",+7 (379) 051-5610,martinovevdokim@yandex.ru,"Art. Makushino blvd. Allied, d. 82, 314 854",32420,43427,F,,83291,,
681,Kryukov Olga A.,"Art. Uglegorsk, ul. Krasnopartizanskaya, d. To 9/6. 5, 518034",+7 (768) 154-05-64,jlihachev@hotmail.com,"Mr. Krasnoural'sk, w. Kalinina, d. 7/6, 815 849",35367,43589,F,144046,96136,1,1
682,Elisha Zhoresovich Davydov,"d. Mostovskoy, pr. Industrial, d. 71 pp. 566, 293 822",8 (411) 412-04-85,martjan33@gmail.com,"COFO Cherkessk, w. Kiev, d. 9 pp. 4/5, 358797",29475,41134,M,,106784,,
683,Seliverstov Ustin Efimevich,"n. Syzran Street. Pleasing, d. 7/5, pp. 491, 283 963",8 780 104 55 64,jaropolk_58@mail.ru,"n. Gubkin, pr. Rowan, d. 385 to. 5, 879,216",22781,42959,M,,69990,,
684,Antonov Guri Terent'evich,"n. Chegem, trans. Revolution, d. 127, 323918",8 (094) 959-44-21,komarovemil@hotmail.com,"a. Yurovsky, nab. Kharkov, d. 2/3 894332",36402,42640,M,,69317,,1
685,Onufry I. Vorontsov,"from. Galitch, pr. Foundry, d. 59 to. 656, 277 352",8 (770) 262-3719,bloginov@hotmail.com,"a. Rebriha, ALL. Ostrowski, d. 771 to. 7 241005",36828,42164,M,,76115,,1
686,Erofei Elizarovich Galkin,"p. Lazarevskoye, bul. Levanevskogo d. 8, 852 551",8 956 205 7443,aleksandr_2005@yandex.ru,"k. Sensation, pr. East, d. 36 p. 9/4, 839,604",37335,41632,M,160205,79372,1,
687,Euphrosinia Antonovna Strelkova,"Mr. Kezhma blvd. Space, e. To 3/7. 53 341 060",+7 (717) 125-8760,afanasevfedor@gmail.com,"Art. Kurilsk, ALL. Krasnoflotskaya, d. 2 pp. 9, 811 850",37266,42446,F,,84523,,
688,Kopylova Anna Ilinichna,"Zhukovsky, bul. 50 Years of Victory, d. 4/5 in. 574 000 779",+7 (840) 651-08-51,elizarkabanov@mail.ru,"Art. Kansk, ALL. Leningrad, d. To 4/5. 8, 855 358",27032,42606,F,270931,101452,1,1
689,Taisia ​​Galkina Matveevna,"d. Votkinsk, trans. Vakhitov, d. 7 to. 52, 542 518",8 301 680 8735,ljudmila_06@rambler.ru,"Art. Dvina emb. Fizkulturnaya, d. 34, 768 694",25936,40976,F,108730,77745,1,
690,Nazar Fokich Fokin,"COFO Turuhansk Str. Geologists, d. 21, 725 770",+7 (626) 576-4060,agap1987@rambler.ru,"from. Novorossiyka, w. Krasnodar, d. 64 to. 171, 769 117",30464,42187,M,170328,87412,1,1
691,Comrade. Shashkoff Laurus Vikentievich,"n. Teriberka pr. Turgeneva, d. 22, 394020",8 634 911 3790,doroninapelageja@hotmail.com,"d. Vyborg, w. Proletarskoye, d. 59 p. 5, 249311",24358,41924,M,179507,79527,1,
692,Socks Ipatii Marsovich,"COFO Aginskoye (Zabayk.), Str. Baikalskaya d. 1 368 382",+7 210 962 5445,mili2001@hotmail.com,"Kyshtym, trans. Ermak, d. 286 to. 9/8 263736",31829,41290,M,244731,82039,1,
693,Medvedev Agafon Bogdanovich,"Kirovsk (Moorman.) ALL. Aviation, d. 4/8, 962 798",8 385 237 38 07,kazimir54@yandex.ru,"n. Novocherkassk, ul. Blucher, d. 9 pp. 4, 549,154",29874,42398,M,,77192,,1
694,Ruslan Trofimovich Sox,"e. Schmidt Cape, ALL. Cossack, d. To 3/9. 6, 296,284",8 (511) 197-1171,david28@yandex.ru,"COFO Ust-Ilim Str. University, d. 34, 767 588",29299,42421,M,,65538,,
695,Sviatopolk Artemovich Lazarev,"Art. Moscow, MSU, bul. Goncharov, d. 31, 219422",+74928213730,abramovavera@hotmail.com,"a. Pinyega Str. People, d. 2 877 287",35344,42022,M,,92374,,
696,Anatoly Isayev Averyanovich,"Art. Achinsk, pr. Karalenka, d. 8/7, 551019",+7 (143) 657-9791,efrem_1986@gmail.com,"n. Skovorodino lane. Martha 8, d. 786 to. 615, 256562",23433,41087,M,,74014,,1
697,Shilov Jan Bronislavovich,"Art. Krimsk, ave. M.Gorky d. 7/1 127025",8 120 526 9353,adrian_21@mail.ru,"from. Morshansk, nab. North, d. 8/7, 282 959",23833,43129,M,,106944,,
698,Kovalev Spartak Fedoseevich,"COFO Orsk, ALL. Minin, d. 2/4 in. 3 678 612",8 (165) 597-61-15,jaropolk_73@hotmail.com,"d. Berezniki, trans. Zaporozhskiy, d. 693 p. 4, 117,048",24933,41369,M,,76049,,
699,Kirillov Zinaida Leonidovna,"a. Yegoryevsk, ALL. Dance, d. 9/5 in. 63 969 825",+7 (796) 722-57-44,ivan75@rambler.ru,"COFO Alagir, trans. Lakeside, d. 7/9, 303 919",28848,41794,F,,69745,,1
700,Aksenov Pelagia Vadimovna,"Tosno, trans. Commune, d. 4, 707,932",8 (490) 002-29-89,zrogov@yandex.ru,"Alagir, ALL. Blind, d. 1 k. 6, 804,356",36495,43518,F,,93093,,1
701,Valentin Zhuravlev Valerianovich,"a. Chernyahovsk, nab. Morozova, d. 212, 156408",8 (829) 095-0619,ljubov_1997@yahoo.com,"Art. Amderma, nab. Karl Marx, d. 685, 502 893",33876,42038,M,147568,77252,1,
702,Stanislav Karpov Eliseevich,"from. Listvianka (Irkut.), Bd. Gorny, d. 9 k. 8/5 396096",8 092 847 91 92,lev_1988@yandex.ru,"COFO Ryazan lane. Transverse, d. 364 pp. 796, 904 020",29818,43567,M,,74777,,1
703,Antonov Zephaniah Eremeevich,"a. Chekhov, ALL. Novgorod, d. 837 to. 93, 441944",8 992 747 59 22,galaktion_1978@yandex.ru,"from. Usolye Siberian, w. School, d. 4 to. 454, 400 350",27948,42029,M,,44879,,1
704,Julia Svyatoslavovna Turov,"Art. Baltiysk, ul. Black Sea, d. 2 pp. 5/9 763657",8 (490) 220-59-38,usharapov@yandex.ru,"d. Usinsk, st. Rainbow, d. 4, pp. 363, 756 392",36577,43499,F,,90445,,
705,Panova Larisa Albertovna,"Art. Olenek blvd. Azovskiy, d. 4 pp. 45, 631 803",+7 (276) 515-7714,irakli_2009@hotmail.com,"COFO Suzdal, w. Schmidt, d. 2/9 p. 1, 722,555",28845,42394,F,,56482,,
706,Ms Dmitrieva Barbara Nilovna,"COFO Gudermes, bul. Linear, d. 4, p. 5, 583,002",+7 (689) 526-6603,bojangordeev@mail.ru,"a. Saransk, trans. Grandma, d. 513 to. 429, 563 511",31784,41274,F,289609,106849,1,
707,Maslova Irina Afanasyevna,"Art. Baksan, w. Fadeyeva, d. 72 to. 31, 143 175",+75774017171,darja_47@yahoo.com,"d. Surgut (Hunt.), str. Glinka, d. 33 to. 48, 259133",23449,41458,F,181309,77602,1,
708,Love Rudolfovna Fedoseyev,d. Shatki Str. Metallistov d. To 654. 2 801 135,8 876 451 89 56,bermakov@mail.ru,"n. Chrysostom, w. Autumn, d. 44, 383 488",26198,42564,F,,110591,,
709,The professor Eduard Kuznetsov,"Mr. Susuman, nab. Russia, d. 521, 473 219",8 543 406 8352,anisim_1970@yandex.ru,"from. Cheboksary, ul. Mayakovsky, d. 6/8, 288 230",26952,41142,M,116122,110219,1,1
710,Irina Blokhin,"Art. Ust-Orda, bul. Volzhsky, d. To 4/5. 4, 519,818",+7 (823) 056-41-86,rodionovaraisa@hotmail.com,"Art. Bologoye, nab. Gastello, d. 37 p. 8/5, 793,243",31110,41581,F,236619,69432,1,
711,Fishermen Love Tarasovich,"COFO Upper Tagil, ALL. Long-distance, d. 7/2, 862 335",8 (664) 107-32-44,ignatovpolikarp@hotmail.com,"n. Elbrus, nab. Ostrovsky, d. 7/7, 626 710",34300,41927,M,170041,105375,1,
712,Yemelyan Demidovich Sharapov,"COFO Belogorsk (Amur.), Str. Karalenka, d. 97 k. 7/2 745931",8 479 731 48 31,fomichevaoktjabrina@yandex.ru,"from. Hot Key, nab. Paris Commune, d. 832 pp. 963, 308 438",28126,43652,M,,87387,,
713,Arkhip Eliseevich Zhuravlev,"from. Suzdal, pr. Tukaya, d. 4 to. 49, 349 224",+7 (216) 897-7051,uvarovaagafja@gmail.com,"from. Chelyabinsk, pr. 30 Years of Victory, d. 452 to. 850 485 369",37187,43178,M,,82306,,1
714,Vorontsov Demid Ilyasovich,"d. Achkhoy-Martan, w. Vodnikov, d. 9, 130955",8 (873) 919-00-84,sidorovaalevtina@yahoo.com,"of Barguzin lane. Ash, d. 9/8, 070 501",29667,41881,M,229472,99892,1,
715,Gennady I. Loginov,"a. Naberezhnye Chelny, w. Marx, d. 744, 065 326",+7 (841) 892-4950,valentin_66@mail.ru,"COFO Ishim embankment. Michurina d. 97 p. 45, 539353",30421,43431,M,,76856,,
716,Mr Volkov Gleb Guryevich,"Art. Ivdel, w. Emb. 98 to. 86, 077 940",+72918871843,hvorontsova@yahoo.com,"d. Axhtubinsk w. Tereshkovoy, d. 2 to. 306, 135913",23336,41630,M,229820,88720,1,1
717,Gordeyev Sebastian Zhanovich,"n. Severo-Kurilsk, ALL. Tomsk, d. 3/6, 349230",8 757 250 77 89,maksimovaalla@yandex.ru,"from. Lyantor, w. Vegetable garden, d. 879, 469 837",29163,42737,M,263423,75217,1,
718,Lubomir Aaranovitch Sobolev,"COFO Arkhangelsk, Embankment. Commune, d. 920 p. 1/3 463548",+7 179 441 4778,zinovi_82@yandex.ru,"Art. Soviet Street. Leo Tolstoy, d. 28, p. 2/5, 014 863",32702,43058,M,,74159,,1
719,Molchanov Fedot Teimurazovich,"Asha, bul. Makarov, d. 2 pp. 8/2 747172",+7 783 896 0963,solovevaolimpiada@rambler.ru,"n. Rubtsovsk Str. February, d. 6, 689,951",31121,42991,M,,96736,,
720,Oia D. Voronov,"from. Naberezhnye Chelny, bul. Stakhanovsky, d. 92 p. 3, 793,367",8 676 897 98 06,vera80@yahoo.com,"a. Timashevsk, st. Priozernaya, d. 8 pp. 39, 091 852",32080,42099,F,,105820,,1
721,Akim I. Guriev,"d. Ruza, ul. Kolhoznaya, d. 2, 153680",+7 (902) 772-4317,boleslav02@rambler.ru,"a. Mostovskoi Str. Rainbow, d. 2/2 p. 11 836 354",32626,43679,M,,66801,,
722,Miroslav Fedoseevich Kudryashov,"a. Syzran, ALL. Gaidar, d. 52 to. 46, 981 303",8 846 133 01 26,porfiri1979@yahoo.com,"g. Ivanovo, bul. Rucheyny, d. 7/4, pp. 916, 067 774",35621,42094,M,,62586,,
723,Blokhin Dobromyslov Zakharievich,"Saransk, trans. Alder, d. 7, pp. 41, 875 562",+7 (126) 250-4991,mironovkuzma@mail.ru,"n. Voskresensk, trans. Volzhsky, d. 434, 250957",29162,43676,M,,76324,,
724,Andronicus Artemovich Arkhipov,"Verkhnyaya Penzhino, nab. Halturina, d. 4/9, 365 158",+7 522 099 89 91,efremovguri@rambler.ru,"a. Minusinsk, nab. Maple, d. 822 to. 52, 333 638",28708,42754,M,176030,84235,1,
725,Yermil Demidovich Konstantinov,"COFO Teriberka Str. Poselkovaya, d. 4 116542",+7 (414) 078-9051,bespalovmir@yandex.ru,"Art. Alapaevsk, w. Chemists, d. 5 to. 948, 827 677",24789,42205,M,,96013,,1
726,Nazarov Andronicus G.,"k. Rebriha, pr. Panfilova, d. 2/6, 293992",+7 (774) 595-66-70,danilovamilitsa@yahoo.com,"from. Bely Yar (Tomsk.) Lane. Yield, g. To 8/9. 9, 030300",26054,43658,M,,58925,,1
727,Ms Tsvetkov Emilia Ruslanovna,"a. Zelenogorsk (Lenin.), Str. Rosa Luxemburg, d. 57 pp. 9, 831 694",+7 (763) 917-8320,kudrjashovarhip@yahoo.com,"n. Kalach-on-Don, trans. Road, d. 12 pp. 806, 092 339",24937,42849,F,,87246,,
728,Lukin V. Nahum,"n. Alapaevsk, bul. Rainbow, d. 7 k. 9/5, 894,605",86960471178,afanasiivanov@yahoo.com,"d. Krasnogorsk (Mosk.), str. Novgorod, d. 5.6 pp. 52, 586 445",31478,41959,M,133913,76311,1,
729,Comrade. Balls Vissarion A.,"COFO Apsheronsk, nab. Blucher, d. 27, 830 481",+7 067 457 29 76,evgraf_36@yandex.ru,"Art. Plesetsk, nab. Neftchiler d. 7/2 p. 8, 246 397",35849,43057,M,175993,65494,1,1
730,Isaev Daniel Avdeevich,"Art. Kropotkin (Krasnod.) Emb. Suburban, d. 8/3 p. 4/1, 932 655",8 (360) 054-82-02,dorofeevaskold@gmail.com,"n. Onega, trans. Large, d. 567 to. 5/9, 687 804",22351,42771,M,,84632,,1
731,Ershov Claudia G.,"k. Irbit, pr. Schorsa, d. 9/4, 033,959",+7 273 786 9154,ljudmila1977@yandex.ru,"k. Korsakov, pr. Tolbukhina, d. 63 k. 9, 627 615",27653,41680,F,,87620,,1
732,Matveev Trifon Filimonovich,"COFO shaky street. Anniversary, d. 2 k. 9, 416158",+7 019 796 30 00,markkazakov@hotmail.com,"n. Asbestos, bul. Deputy, d. 527 pp. 27, 134 787",23711,42396,M,,79712,,1
733,Fedoseyev Faina Stanislavovna,"from. Kamyshin, w. Coastal, d. To 2/4. 71, 292929",+7 (385) 281-56-24,ivanovavasilisa@yandex.ru,"a. Inta, bul. Pushkina, d. 16 to. 93, 975 868",37462,42208,F,290177,53003,1,
734,Martynov Agatha Timofeevna,"Karachaevsk, nab. Mira. 1 pp. 1/5 581287",+7 (504) 940-5444,kasjansorokin@yahoo.com,"n. Essentuki, bul. Labor, d. 4/1, 653 522",37515,41212,F,,74660,,
735,Samson Feoktistovich Safonov,"COFO Elista, nab. Shaumyan, d. 4/7 pp. 997, 938 960",8 703 822 82 64,janvishnjakov@mail.ru,"Art. Glazov, ALL. Budyonny, d. 63, 309 605",34595,41899,M,182274,87735,1,1
736,Mr. Kapustin Radislav Yevseyevich,"d. Lotoshino lane. Revolution, d. 428 pp. 8, 340 058",+7 (792) 163-34-58,aleksandra_1974@yandex.ru,"from. Belogorsk (Amur.) Emb. Geologists, d. 60 pp. 527, 200 432",29466,43684,M,,68443,,
737,Suvorov Iraida K.,"n. Vilyuysk, nab. March 8, d. 75, 774 424",87988253554,marina31@mail.ru,"d. Ust-Kalmanka, w. Installers, d. 3, p. 8, 412881",29581,43375,F,241115,79924,1,1
738,Cats Bartholomew Z.,"Mr. Murashi blvd. Vavilova,. 2/4 p. 5/2, 685 459",+74090445044,ernest2004@yandex.ru,"COFO Priozersk, bul. Paris Commune, d. 2 455 760",26945,43124,M,103440,84596,1,
739,Socks Agathon Daniilovich,"d. Turukhansk ALL. Voykova, d. 23, pp. 379, 472 326",8 (420) 874-3385,kovalevaangelina@hotmail.com,"Art. Aleksin, pr. ZHuravleva, d. 5 to. 900, 814 330",34007,41409,M,,72041,,
740,Molchanova Elena,"Mr. Olenek, trans. Suvorov, d. 110 p. 557, 461132",88960899534,dobroslav_2005@rambler.ru,"COFO Kashira, nab. Moonlight, d. 3/3 p. 7/9, 024 923",27050,41700,F,,78239,,1
741,Zinoviev Valery Makarovna,"from. Monchegorsk, nab. Kazan, d. 1 p. 576, 259175",8 553 432 9903,mihail36@hotmail.com,"n. Amursk Str. Ivanovskaia, d. 420 p. 3, 732,069",37167,42415,F,190077,88027,1,1
742,Krasil'nikova Sinklitikiya Vladislavovna,"Art. Sukhinichi, nab. The station, d. 5/3 p. 8/3, 930 958",+7 519 615 90 81,fturov@gmail.com,"from. Lagan, bul. Border, d. To 189. 3 965 250",22526,41053,F,249092,88001,1,1
743,Marina V. Lobanov,"from. Anadyr, pr. Bunker, d. 4/3 151170",+7 (283) 894-95-22,nifont_71@yahoo.com,"Art. Magas, ALL. Hope, d. 415 p. 6/2 878358",31470,41335,F,,69641,,1
744,Mitofan Ignatievich Vladimirov,"Art. Serednikovo, ALL. Revolutionary, d. 4/9, 432 975",8 (180) 590-2354,ostap63@rambler.ru,"from. Odintsovo, nab. Chaikinoi, d. 5/5, 809 061",32577,42661,M,112596,77036,1,1
745,Nuts Stanimir Edgarovich,"a. Rybinsk, trans. Proletarskii, d. 5 k. 5, 217,192",83797030630,longinsharapov@gmail.com,"Art. Yar-Sale, pr. Kutuzova d. 8/1 989020",22585,42856,M,,69046,,1
746,Naina Gennadievna Kolobov,"a. Valdai lane. Floatable, d. 3/3, 758 557",8 225 727 18 62,izotfedoseev@rambler.ru,"a. Bomnak blvd. Privokzalny, d. 69 p. 4 969 430",23746,42680,F,,71595,,
747,King James Fedoseevich,"n. Mostovskoy, pr. Polar, d. 455, 256 851",+7 (664) 230-6077,fedorovanikita@mail.ru,"n. Vladivostok, ALL. Nakhimova d. 7 pp. 7/9, 155,314",37017,40982,M,233850,76667,1,
748,Vasiliev Hilarion Vladilenovich,"d. Nalchik, bul. Nagorny, d. 2 953 326",8 883 007 0298,igor1971@rambler.ru,"COFO Wasp, trans. Club, d. 182, 656 706",32368,43225,M,193559,67847,1,1
749,Seliverstov Volkov,"d. Sol-Iletsk, bul. Schmidt, d. 907 pp. 97, 913 619",+78757772722,solomon_1975@rambler.ru,"Art. Yakhroma, w. Deputatskoye, d. 71 p. 7, 826,682",35486,42094,M,,99174,,1
750,Gavrilova Agatha Yulyevna,"COFO Uchaly, ALL. Semashko, d. 6/3, p. 561, 261715",82843954711,medvedevluka@yandex.ru,"n. Ruza, trans. Lyavonau, d. 5 k. 5, 151,051",22084,41122,F,,110256,,
751,Onufry Davidovich Teterin,"Asha, ul. Schorsa, d. 5 pp. 3/3 885897",8 (586) 136-18-91,zhukovaanzhelika@yandex.ru,"Art. Troitsk (Mosk.), Str. Serafimovicha, d. To 6. 20, 001 932",34518,41225,M,,95574,,
752,Sidor Nikonov V.,"from. Pechenga, ALL. Bazhova, d. 381 pp. 140, 323 982",8 (121) 288-25-80,milennovikov@hotmail.com,"d. Kizel, bul. Popov, d. 4/9, pp. 47, 406074",33098,43694,M,299768,87582,1,
753,Nathan Nosov Filimonovich,"from. Birobidzhan, bul. Spring, d. 53 pp. 510, 884 319",8 (625) 450-3822,ivanovagalina@yandex.ru,"Hasan, trans. The trade union, d. 8/8, 582 526",28331,42759,M,,106359,,
754,Bartholomew Avgustovich Subbotin,"n. Lotoshino lane. Krupskoi d. 31, 516 464",+7 (788) 158-2088,mefodi_2016@mail.ru,"n. Semlyachiki blvd. Sports, d. 494 p. 6, 033,594",33932,41693,M,,73769,,1
755,Oleg Sidorov Iosipovich,"d. Narym, pr. Hay, d. 640 to. 3 377915",8 (867) 544-60-14,azari1971@gmail.com,"Art. Tsimlyansk Str. Lilac, d. 729 pp. 79, 379 740",29952,42012,M,,88377,,1
756,Tatiana Ershova Danilovna,"Petuhovo, trans. Gagarina, d. 665 pp. 404, 304 857",8 668 638 4420,wshchukin@yahoo.com,"Art. Urengoj, pr. Der, d. 54 to. 7, 035,886",31418,41256,F,,75950,,
757,Shestakov Regina Filip,"a. Chegem, w. Shahterske, d. 25, 605 764",8 963 995 06 07,lknjazev@rambler.ru,"n. Kachkanar, nab. Socialist, d. 323 pp. 316, 467 169",32877,42262,F,,95648,,
758,Mironov Pimen Artemyevitch,"d. Kalach-on-Don, trans. Grandma, d. 17 to. 276, 169 739",8 647 854 7484,evdokimjudin@yandex.ru,"d. Tot'ma Str. Olympic, d. 74 in. 828 318 173",34506,41082,M,,82212,,1
759,Shooters Yuri Vilorovich,"from. Smolensk, w. Industrial, d. 1 087 898",8 (163) 066-95-72,orlovataisija@hotmail.com,"a. Arkhyz, nab. Medium d. 420 to. 286, 381133",29951,43038,M,,87829,,
760,Elizabeth Stepanovna Guschina,"n. Kyshtym, w. Voroshilov, d. 3, p. 4, 312,891",87107733983,mbeljaev@gmail.com,"from. Kirishi, bul. Kuban, d. 9/6 in. 545, 434136",29746,42303,F,211980,71295,1,
761,Evdokia L. Lebedev,"Art. Gus Crystal, ALL. Dobrolyubova. 124, 328660",8 138 537 3717,maksimiljan_1984@yahoo.com,"of Suntar, ALL. Rural, d. To 4/5. 35 783 012",27277,43033,F,210231,85359,1,1
762,Galina Dmitrieva Tarasovna,"from. Vuktyl blvd. Birch, d. 9 pp. 749, 279 457",8 (420) 007-6843,jdenisov@yandex.ru,"Art. Adygeysk, pr. Greenhouse, d. 7/7 pp. 280, 967 652",35123,42195,F,104581,73752,1,
763,Parfyon Evseevich Shashkoff,"Art. Solovki, trans. 9 January, d. To 5/2. 71 063 049",8 (405) 368-5660,galaktionpopov@gmail.com,"from. Ust-Dzheguta Str. Snow, d. 3, 301,463",29725,41780,M,250520,70599,1,
764,Agata L. Frolova,"from. Ust-Orda, st. Sakhalinskaya d. 1/7 p. 7, 269,148",8 820 494 7177,ippolit_74@yandex.ru,"COFO Dolinsk, w. Gorky, d. 8/1, 455 605",37114,43442,F,,67714,,
765,Valentina S. Kononov,"a. Divnogorsk, nab. Steppe, d. 1 k. 27, 472 661",8 (252) 013-3255,gerasimovaanastasija@rambler.ru,"from. Chulym, pr. Snow, d. 834 to. 68, 165 941",24115,42420,F,107236,92802,1,
766,Stanimir Eremeevich Semenov,"Primorsko-Akhtarsk, w. Quiet, d. 4, 019,665",+7 629 850 34 58,olga50@yahoo.com,"COFO Kalyazin, ALL. Tomsk, d. 7 pp. 8, 618 304",24038,42657,M,,69334,,1
767,Raisa Vladislavovna Rogov,"Art. Kamen-na-Obi, w. The labor, d. 7 to. 657, 222 228",8 134 444 48 72,samsonovleonti@hotmail.com,"n. Novomichurinsk Str. Postal, d. 518 pp. 92, 850 629",25905,42309,F,,119023,,
768,Antonina Chernova Rudolfovna,"d. Meadows, nab. Yeniseyskaya, d. 910 to. 1 529 959",80097086166,ipati_03@yandex.ru,"a. Zhigulevsk, bul. Marsh, d. 610, p. 9/5, 061,919",30911,42024,F,,78368,,1
769,Nikifor Dimitrijevic Zuev,"Cheremkhovo, nab. Trading, d. 3, p. 5, 557,237",+7 (595) 984-0545,davidovlavrenti@yahoo.com,"d. Uglegorsk, pr. Vidradny, d. 4/2, 338,540",27012,42665,M,,82872,,1
770,Krasil'nikova Oia Timofeevna,"k. Chulym, pr. Ivanovskii, d. 8/7 p. 2 530 835",+7 (672) 934-0354,demidfilatov@yahoo.com,"a. Uglich, w. Stepan Razin, d. 74 in. 3/6, 508 993",34318,42169,F,199800,100765,1,
771,Isaev Miroslav Isidorovich,"COFO Khimki, ALL. Marx, d. 7/9 p. 2 663 995",8 673 084 9861,natan_2017@mail.ru,"from. Ples, trans. Ryazan, d. 5/5, 693 919",30423,41229,M,,95652,,1
772,Agata G. Shilov,"a. Kostomuksha Str. Altitude, d. 313, 276094",8 745 131 11 83,rogovaregina@rambler.ru,"from. Moscow, pr. Meliorativny, d. 3/2, 683 731",36278,42467,F,,71829,,1
773,Xenia Vyacheslavovna Shiryaev,"a. Krasnoufimsk, ALL. Lacustrine, d. 4, 507,878",8 216 979 53 99,valentin_53@hotmail.com,"a. Great Ustyug, w. Trade, d. 329, 896 600",30026,43351,F,,82034,,
774,Lazarus A. Alexandrov,"Strezhevoy, street. Road, d. 2 to. 782, 475 600",+7 (069) 647-33-85,ljubov_2002@gmail.com,"Taishet, etc. Tchaikovsky, d. 4/3, 029 669",33396,43013,M,142396,117211,1,
775,Doronin Naina Ilinichna,"Art. Belogorsk (Amur.) Emb. Raspberry, d. 462 to. 756 535 537",8 549 649 28 14,foka1986@rambler.ru,"Art. Aginskoe (Zabayk.) Emb. Plekhanov, d. 1/7 p. 1/7, 718 916",31206,42925,F,138594,93526,1,1
776,Panfil Vladlenovich Sokolov,"d. Aniva Str. Revolutionary, d. 63 p. 9/4, 262 120",8 (931) 246-3775,trofimovmaksim@yandex.ru,"Domodedovo, bul. Makarov, d. 4, 975,409",28388,41734,M,,69391,,
777,Galkin Yevstigney G.,"n. Petrozavodsk, w. 70 years of October, d. 63 to. 828, 202900",+7 (118) 732-8885,solovevsaveli@hotmail.com,"d. Schelkovo, w. O.Koshevogo, d. 40 pp. 47, 867 509",27144,41622,M,,79403,,
778,Pestles Selivan B.,"Ardon, trans. October, d. 593 to. 20, 967 270",+7 (126) 912-71-90,alevtina1986@mail.ru,"a. Vnukovo (meteost.), Str. Grandma, d. 53 to. 5, 954,138",34151,42639,M,,66987,,1
779,Varvara Fedorovna Maslov,"COFO Gudermes ALL. New, d. 535, 470 657",+7 613 387 13 16,averki_34@yahoo.com,"Art. Shuia, pr. Harbor, d. 5, p. 5, 502,842",22387,41128,F,,66727,,1
780,Dmitry Averyanovich Fedoseyev,"n. Ust-Kut, trans. Embankment. 9/2, pp. 570, 268 286",+7 728 123 9622,titovereme@yandex.ru,"n. Slyudyanka, trans. Karl Libknehta, d. 32 p. 79, 021698",29328,40950,M,112993,81199,1,
781,Kuzmina Eupraxia Efimovna,"d. Kimry, w. Tulenin, d. 29, 118 244",8 (951) 865-25-95,novikovpolikarp@hotmail.com,"a. Yelabuga street. Caucasian, d. 8 to. 97, 972 528",32665,42243,F,,88557,,
782,Fadei Vladislavovich Shchukin,"n. Kotel'nich, ALL. Linear, d. To 7/3. 66, 343154",+7 981 762 6341,kuznetsovoleg@yandex.ru,"Art. Shelekhov, bul. Parkhomenko, d. 486 pp. 330, 975 678",29903,42659,M,,77536,,1
783,Irina Smith Artemovna,"a. Bronnitsy, ALL. Queen, d. 5/4, 728 382",83450262686,frolovjakub@yahoo.com,"Art. Kansk, w. Track, d. 7, p. 638, 108113",36361,43424,F,286427,83761,1,
784,Mr. Gorbounov Yevstigney Benediktovich,"n. Yegoryevsk, trans. Bryansky, d. 8 to. 561, 179942",+74627075747,zmolchanov@gmail.com,"n. Elton, pr. Popov, d. 6.4 pp. 69, 608 704",28509,41836,M,,74866,,1
785,Luchezar Davidovich Gavrilov,"COFO Zaraysk, ALL. Omsk, d. 8.5 pp. 25, 547 528",+7 466 820 03 42,matveantonov@hotmail.com,"Art. Nyagan, w. Serov, d. 9/4, 905 423",27456,41661,M,,99874,,1
786,Larisa Rudolfovna Dorofeeva,"a. Sosnovy Bor, bul. Festival, d. 8/7, 018 097",86603919533,arhipovaivanna@gmail.com,"COFO Vorkuta, pr. Factory, d. x 6/5 in. 986, 765 707",26848,43461,F,,91562,,
787,Dmitry Vinogradov Antipovich,"Art. Petropavlovsk-Kamchatsky, ALL. Road, d. 45 in. 3/6, 065 016",+7 729 835 67 83,vasilevinnokenti@yandex.ru,"COFO Volgograd, st. Space, d. 84, 049 091",26268,43548,M,,54543,,
788,Lyubosmysl Afanasievich Baranov,"COFO Suzdal, pr. Sand, d. 806 to. 3/9, 351,535",+7 749 068 3275,kondratevamaja@mail.ru,"COFO Shelagontsy, trans. Fadeyeva, d. 57 to. 96, 367 586",22942,43156,M,,97352,,
